id,name,description,supplier_id,category_id,grade_average,is_active,brand_id,created_at,updated_at
750,Foreign,Management science allow pattern individual from fine small prevent.,128,48,0.8414805623407329,True,3,2020-06-07,2020-06-07
751,Do moment economic professional law,Others white where part think morning already sure.,128,48,0.8729481994499882,True,10,2022-10-07,2022-10-07
752,Peace,Book support happen no understand stay.,128,49,2.0122994247428725,True,42,2023-07-20,2023-07-20
753,Value risk foreign,Week talk I defense friend ever.,128,49,4.920364445313719,True,43,2023-08-28,2023-08-28
754,Mrs,Reflect toward drive enter pass six behavior avoid state if nearly.,128,49,1.0499203895527542,True,42,2023-08-14,2023-08-14
755,Surface,Behind police than if care produce present father model play friend so write.,128,49,2.817368020165898,True,17,2022-07-28,2022-07-28
756,Money,News career have throw ten realize remain herself even director floor.,128,49,3.4842192012939446,True,33,2023-08-22,2023-08-22
757,High,Sell reach coach money what sure wind town difference smile military.,128,49,2.2434813422841615,True,28,2021-01-23,2021-01-23
758,Family meet wall common,Suffer add easy term lose billion attorney modern.,128,49,1.8862839300638563,True,12,2021-04-15,2021-04-15
759,Culture,If bit arrive seven specific administration ago stay especially thank today.,128,49,1.6665295627905223,True,30,2023-11-01,2023-11-01
760,Admit eight father majority,But matter program office quite quite stuff model.,128,49,1.1733831229101188,True,3,2021-08-05,2021-08-05
761,Huge,Over financial guess through financial true value cell anything charge responsibility nothing memory.,128,50,1.6716692668817656,True,49,2022-02-18,2022-02-18
762,Way,Standard pull least other care according prevent property few region.,128,50,0.19469824156390425,True,12,2020-06-23,2020-06-23
763,Large,Thus these him cover force cell born pretty.,128,50,3.5991346102467077,True,28,2022-12-15,2022-12-15
764,Minute area help,Modern style cell him kitchen stop general interest.,128,50,4.496613593197576,True,44,2023-06-23,2023-06-23
765,Tend religious,Goal recognize matter Democrat fast purpose later subject religious return throughout huge.,128,50,2.3226545386418644,True,2,2021-09-29,2021-09-29
766,May anyone present so,Cost true find interest bed international community share our her argue child.,128,51,1.1921561871208746,True,1,2020-08-06,2020-08-06
767,Bag,Eye kind back represent skin law sign itself.,128,51,1.9450424431773972,True,22,2023-06-13,2023-06-13
768,Involve debate,Tough several instead what make accept.,128,52,3.4850372665466347,True,41,2021-12-17,2021-12-17
769,Alone,Letter range market sea itself building miss.,128,52,1.6887955623595197,True,30,2023-09-17,2023-09-17
770,Worry movie,Affect everything let level chair expert week hotel federal itself face third.,128,52,2.021276406805959,True,31,2021-08-07,2021-08-07
771,Doctor media child agreement exactly,You minute crime size whom item rock design door week data seat maintain.,128,52,0.02550836172699189,True,30,2023-08-17,2023-08-17
772,Want,Chair industry of magazine firm without best wife per contain might forward heart.,128,52,2.5946335899651896,True,20,2021-07-18,2021-07-18
773,Sense,Parent nature pick option economy anyone responsibility effort especially bill real power.,128,53,0.8004891753491228,True,48,2020-12-07,2020-12-07
774,Agree usually,Style student fact for floor forget save remain take scientist call recognize.,128,53,3.3003279139146278,True,42,2020-07-22,2020-07-22
775,Human,Drive pretty large performance training far organization leave seat real move case.,128,53,1.3159723848221554,True,30,2023-04-06,2023-04-06
776,Full six different treat design,Then upon price rather office even top another notice lead traditional item.,128,53,2.1243431504816024,True,9,2021-07-26,2021-07-26
777,You,All people why result weight Republican assume production.,128,53,4.865808259844566,True,14,2023-09-22,2023-09-22
778,Staff,Protect program financial late science article young cut.,128,53,3.3357136990079095,True,37,2021-12-30,2021-12-30
779,Close,Project Republican senior plan himself discussion.,128,53,4.3661579238632475,True,5,2023-11-20,2023-11-20
780,Back Congress,Explain house three environment your mention model customer contain from training upon technology.,128,53,4.579159225185821,True,26,2022-08-15,2022-08-15
781,Money,Example forget may thing imagine ask year alone team.,128,53,4.7407043486438445,True,34,2023-10-09,2023-10-09
782,Particular listen action,Usually significant fly letter effort despite.,128,54,4.3237331509944354,True,50,2020-02-04,2020-02-04
783,Represent nothing develop offer,Own program resource happy president natural fine foot until chair wife back buy.,128,54,3.0544653905076706,True,17,2023-03-08,2023-03-08
784,Early,Imagine beautiful when past born charge.,128,54,4.689437957169236,True,15,2020-12-15,2020-12-15
785,Or spend year significant,Notice every prevent find responsibility end education five first.,128,55,0.4710332044184712,True,31,2022-01-14,2022-01-14
786,Take,Successful receive land her city safe century sort learn material.,128,55,3.645447609182484,True,13,2023-03-05,2023-03-05
787,Example side across upon middle,Red before pressure night subject check prevent often at national same risk goal.,128,55,3.2792495310249254,True,37,2022-04-09,2022-04-09
788,Unit network,Agent during customer decade partner necessary commercial very dark Congress president memory name.,128,55,0.9522648388208305,True,11,2023-10-01,2023-10-01
789,With building,Music woman development lot mission deal whole think.,128,56,3.246497498130709,True,47,2023-10-18,2023-10-18
790,Make we word,Stuff audience small camera room another score fast.,128,56,4.9663555541926865,True,43,2023-01-04,2023-01-04
791,Four development,Deal song experience prepare both determine have prove talk political benefit threat mission maybe.,128,57,4.682985496672573,True,28,2021-11-16,2021-11-16
792,Support,Central force card close provide nice.,128,57,2.3361261710810477,True,10,2020-12-03,2020-12-03
793,Spring different start economy,Situation author job toward help into practice during born election.,128,57,4.2667131373805205,True,9,2022-11-20,2022-11-20
794,Agent there,To seven test attention activity position summer cold pick surface effect.,128,57,4.665589068438841,True,25,2023-11-13,2023-11-13
795,Price,Seek four improve future memory politics.,128,57,2.880517788523695,True,21,2022-08-12,2022-08-12
796,Ever learn season,Do individual better factor whose clear general property all simple seek.,128,57,3.95328405106256,True,43,2022-08-21,2022-08-21
797,Middle item,Head people professor me consider next go.,128,57,3.962280868056779,True,3,2023-09-27,2023-09-27
798,Forward close,Those increase toward true window those recent.,128,57,0.3213311568295618,True,44,2021-04-17,2021-04-17
799,Keep,Decision sure operation customer cut democratic continue school she long side common include.,128,57,1.4120221584729835,True,25,2022-08-17,2022-08-17
800,Newspaper,Body research process ok region on.,128,58,3.939390999538542,True,47,2022-09-04,2022-09-04
801,Cold type,Individual base price something development quite including term upon like.,128,58,2.2147659964553124,True,11,2022-12-24,2022-12-24
802,Party score,Star action second author how create others garden night.,128,58,4.36530830500086,True,1,2022-11-07,2022-11-07
803,Amount choose,Truth teacher however military protect growth son heart between institution certain.,128,58,2.2975486115447463,True,32,2023-08-30,2023-08-30
804,Win,Maintain job I late couple sense.,129,3,3.8983350342759406,True,36,2020-03-25,2020-03-25
805,Low fly,Sea nor success new manager hospital collection three foot recently with design term.,129,3,2.2815417901170503,True,15,2022-01-25,2022-01-25
806,Gas group data particularly,Keep court summer kid civil defense during.,129,3,1.6452644402275884,True,28,2020-10-03,2020-10-03
807,Marriage best will but,Hand voice arrive edge I interest especially scientist think.,129,3,3.316654175625297,True,1,2022-07-13,2022-07-13
808,Poor,Chance test change leader something author half probably remain near improve professional.,129,3,0.3852042036437908,True,23,2022-10-14,2022-10-14
809,Drive thing,Those maintain score inside realize stage three certain information thank.,129,3,2.0405192320189123,True,45,2020-12-17,2020-12-17
810,Can,Event shake old none room different reveal window glass shake safe able.,129,4,3.0154494779671865,True,5,2020-01-02,2020-01-02
811,Use environment,Account recognize director guy cover western west south fall let table.,129,4,0.6608821464652659,True,20,2023-06-25,2023-06-25
812,Thing side,Study true instead data factor foot clearly former role.,129,4,0.19298431644446223,True,4,2020-01-10,2020-01-10
813,Decade,Point nor street his friend west enter raise body them rock ever.,129,4,0.4664849125977366,True,18,2021-03-17,2021-03-17
814,Value account,Town second special above body walk before charge recently whatever behind race affect.,129,4,4.144478970514855,True,26,2021-09-22,2021-09-22
815,Know experience,Late drive cost southern money bill expect race drop.,129,5,2.486533164122906,True,26,2021-11-22,2021-11-22
816,Statement,Happen include medical personal forget own his food control.,129,5,2.0249445632195338,True,41,2022-08-26,2022-08-26
817,Wall,Word large name tree wrong us fast final character nice this.,129,5,4.355432508152956,True,39,2022-07-16,2022-07-16
818,Product reach rule who safe,Small face sign writer fund audience carry.,129,5,4.2245167752944175,True,4,2022-10-16,2022-10-16
819,Safe,Eight around if instead chance head then never.,129,5,2.130600947075796,True,7,2020-01-13,2020-01-13
820,Thing,Structure understand world might itself customer involve.,129,5,4.262785681974716,True,5,2020-10-11,2020-10-11
821,Day,Month customer those good none matter property against discover term.,129,5,0.8791148383323283,True,26,2021-11-13,2021-11-13
822,Difficult soon apply,Fact wait close situation home until life which change of father.,129,5,1.0145171405418196,True,14,2020-02-01,2020-02-01
823,Smile grow,Paper fight everything owner less magazine respond develop nor everybody.,129,5,1.4932645462816874,True,16,2022-03-07,2022-03-07
824,Way,Identify good here then crime without sound sea baby he.,129,5,2.0648972288334266,True,13,2023-01-02,2023-01-02
825,Mrs fight stage list,Fine take hope enough sea million practice whole describe television show four shoulder perform.,129,6,3.3787518345558674,True,10,2023-07-28,2023-07-28
826,Make discover white,Consumer century must within great analysis green across course.,129,6,2.2272216541269625,True,17,2022-04-26,2022-04-26
827,Alone,Own point teach southern half public.,129,6,0.24805373348753323,True,34,2022-09-15,2022-09-15
828,Old purpose,Lose professional all three candidate clear fine.,129,6,1.6327936086784929,True,33,2022-10-17,2022-10-17
829,Bed himself something,Family deal art news they foreign media reduce its table hundred great happen.,129,7,2.382701241531624,True,47,2021-12-06,2021-12-06
830,First catch decide coach,Hit thing board law can how instead beat character not represent.,129,7,1.2206518931467614,True,21,2021-10-05,2021-10-05
831,Letter traditional shoulder kitchen,Painting worker traditional group conference doctor theory man military those.,129,7,3.96522866943287,True,21,2020-02-28,2020-02-28
832,Attack stock,Eat watch whole television score sister according huge item Republican whose condition quality.,129,7,3.935260097750573,True,12,2021-11-03,2021-11-03
833,Accept both,Prove vote these sign toward office.,129,7,2.1473860263562927,True,6,2023-10-12,2023-10-12
834,Wind including,Stop various bill hot common available arm or city think.,129,7,0.35015057342129674,True,5,2022-05-23,2022-05-23
835,Stand together,Week involve ahead ahead detail century both television security decade project.,129,7,1.267541920451456,True,21,2020-01-10,2020-01-10
836,Provide professor,Unit shake ever social goal gun western suddenly middle.,129,7,2.5084248555322732,True,6,2021-03-07,2021-03-07
837,Sure ok your day,Show single could test oil despite service true.,129,7,1.4209796669775931,True,11,2023-08-03,2023-08-03
838,Woman ever,Herself girl common drive step include source grow describe argue over save oil.,129,8,4.952626568804506,True,9,2023-04-26,2023-04-26
839,Consider reduce model,Red area seat learn race someone entire attack a ever knowledge senior.,129,8,1.0346472769454347,True,14,2021-08-20,2021-08-20
840,Seek,Population foreign size himself challenge part spring modern resource allow safe.,129,8,2.7824264561184036,True,40,2023-08-08,2023-08-08
841,Whether,Capital can key market represent act knowledge dog year.,129,8,2.734082027857907,True,17,2022-04-04,2022-04-04
842,Join,Eat might crime computer benefit appear phone government senior teacher management worry find.,129,8,1.5546704011133228,True,21,2022-07-31,2022-07-31
843,Herself challenge,Full right political marriage night wear leave five well back growth during skill before.,129,8,3.3668030542094645,True,39,2020-09-22,2020-09-22
844,Wall finally,Simply than music commercial recent important on enough budget list after she.,129,8,4.172352353222574,True,2,2023-06-09,2023-06-09
845,Similar agent really particular,Break deep beautiful yeah begin fall beat society.,129,8,3.3759275341404105,True,23,2020-09-10,2020-09-10
846,Never phone garden,Education learn change instead radio contain tonight available painting information.,129,9,1.8530676663996775,True,14,2020-10-09,2020-10-09
847,Attack nature drug fast,End whatever large different admit local particularly city both.,129,9,4.7147240267647925,True,2,2022-01-02,2022-01-02
848,Agent,Involve traditional keep civil believe up six.,129,9,1.062438342527614,True,4,2020-01-30,2020-01-30
849,Quickly Mr,Whom man lose audience business hotel media out shoulder fly nor allow year.,129,10,1.6199632349415656,True,24,2021-08-08,2021-08-08
850,Religious budget,Suddenly administration meeting significant million why reveal sing guess though generation.,129,10,1.202923448598825,True,30,2020-05-24,2020-05-24
851,Republican,Off support here by with machine style become fill thing.,129,10,0.7190269230364904,True,29,2021-08-02,2021-08-02
852,Significant write,Fill place shake customer everybody poor candidate market democratic eight responsibility try.,129,10,1.7534653198768868,True,37,2023-04-10,2023-04-10
853,What hundred,Current its make hand education pressure just save nice left.,129,11,0.5657265262714778,True,1,2021-06-03,2021-06-03
854,Population,Stand art material store help very leave movement despite avoid subject fish administration.,129,11,2.643666918059089,True,16,2024-01-05,2024-01-05
855,Executive both friend last,Majority specific hair into let almost allow probably full among less eight seek.,129,11,1.0257044718153674,True,47,2022-11-22,2022-11-22
856,Skill,From PM market candidate any again phone keep.,129,11,0.7321316116056492,True,45,2022-03-13,2022-03-13
857,Hear new economic,City watch kid federal pattern garden.,129,11,2.7752708769785066,True,48,2023-12-02,2023-12-02
858,Spend answer item color,Character than local see scientist middle case development.,129,11,3.5552207310957513,True,49,2021-04-06,2021-04-06
859,College suggest,Idea factor expert good thought protect wide thing draw require.,129,12,3.301047402191154,True,48,2021-05-12,2021-05-12
860,Follow meet book large light,But visit truth area pass report by speak anyone she page.,129,12,1.3329105425488053,True,38,2021-12-17,2021-12-17
861,A,Where us half she certainly teach old animal bad.,129,12,3.6706300066097155,True,18,2020-07-29,2020-07-29
862,Middle,Owner to price heavy final role sometimes four rule defense who.,129,12,2.9706035767481884,True,45,2022-09-01,2022-09-01
863,While,Understand try charge big manage according course although.,129,12,0.31035093918641565,True,10,2021-05-08,2021-05-08
864,Natural,Work bag talk idea close kitchen off test long instead.,129,12,3.865315444153718,True,43,2023-04-25,2023-04-25
865,Shake thus action,Wrong new film these tough job.,129,12,2.629199158182285,True,45,2023-10-21,2023-10-21
866,Drug,Grow bank option threat enough finally everything.,129,13,3.742312606084577,True,42,2022-01-09,2022-01-09
867,This car,Example however explain worry nor agreement.,129,13,1.9025087582421119,True,50,2022-05-20,2022-05-20
868,Them year food,Expect author peace half stop authority operation final wear buy.,129,13,2.6387676334958217,True,12,2020-02-15,2020-02-15
869,Tonight than,Star nothing tonight trade despite ball there improve call morning site training executive.,129,13,4.602530116183219,True,8,2022-11-14,2022-11-14
870,Reason set,Threat claim each American sure image ten protect prevent realize.,129,13,2.6734132632494267,True,13,2020-08-07,2020-08-07
871,Customer they candidate one,Operation Democrat maintain protect section relationship of.,129,13,4.245633687728674,True,37,2020-01-03,2020-01-03
872,Human second response affect,Audience require evening until letter certain eat relate.,129,15,0.4197424221299634,True,36,2020-12-22,2020-12-22
873,Heart,Explain expert theory second expert matter catch space knowledge sit baby plant.,129,15,0.40443323201441006,True,2,2020-06-01,2020-06-01
874,Center remain kind,Miss ability program accept movement data late vote.,129,15,1.3635690061699735,True,9,2021-07-15,2021-07-15
875,Call,Energy picture room cover summer side hope recently.,129,16,3.0409952818661337,True,26,2023-12-21,2023-12-21
876,Apply time,Study condition leader somebody maybe head have amount speak inside.,129,16,0.7643642222065244,True,29,2023-02-07,2023-02-07
877,Believe call,Unit able enter around race claim size character pull prove.,129,16,0.8885570058355785,True,12,2020-07-12,2020-07-12
878,Enough ahead which majority western,Either sport which dream develop price use land second seven food happy year.,129,16,1.2823676740502699,True,28,2020-09-08,2020-09-08
879,Congress,So sure significant oil situation recent.,129,16,1.4650326074891855,True,26,2020-11-09,2020-11-09
880,Summer analysis,Most experience president suddenly not cup policy.,129,16,1.0189111081921736,True,29,2022-02-15,2022-02-15
881,Amount,Approach this why of center travel take wrong join attack first.,129,16,1.3984850948114258,True,45,2021-12-21,2021-12-21
882,Down power so explain,Stay Congress simple who system turn wonder majority down.,129,16,3.510890080679923,True,42,2022-02-20,2022-02-20
883,One room it,Serve per discussion often history certainly bed source.,129,17,1.6238880805960636,True,31,2021-05-17,2021-05-17
884,Statement give expert leave,Rise laugh pass against child car success.,129,18,4.811492908920459,True,35,2022-03-05,2022-03-05
885,Something represent,Newspaper say bit have need take price stuff.,129,18,3.7819420979207745,True,29,2022-05-16,2022-05-16
886,Whom,Nation billion note coach agency eight again deal religious former.,129,18,1.5722033366892585,True,2,2022-09-26,2022-09-26
887,Summer,Ok describe spring old study station finish development behind shake watch.,129,18,4.9317411899138595,True,17,2020-10-26,2020-10-26
888,Door rise decide what,Staff several risk drop commercial hold director forward agree get address.,129,19,0.39245236259034644,True,43,2020-12-22,2020-12-22
889,Allow war seek us,Another spring idea hair by animal who season manage friend PM development.,129,19,0.7581343235925536,True,10,2022-03-30,2022-03-30
890,Trial,Congress line pattern toward attorney back claim again surface for.,129,19,4.694648038315718,True,10,2023-06-04,2023-06-04
891,Throughout store TV,Type design college maintain toward garden break these really bad fish.,129,19,3.1649403856945124,True,42,2023-05-08,2023-05-08
892,Rate card toward,Loss continue kitchen world rock market sell place.,129,19,0.3862791864421389,True,47,2020-01-07,2020-01-07
893,Teacher find everyone,Simply trip chair upon house PM goal blood which.,129,19,3.5717161382021096,True,26,2020-05-11,2020-05-11
894,Air,Occur white from shoulder teach thought situation lead account owner.,129,19,3.4593742142152766,True,10,2020-10-17,2020-10-17
895,Dinner decade,Term center mission economy sister me own dog near.,129,19,1.1899733494383562,True,8,2021-05-06,2021-05-06
896,Production,Else knowledge seem allow likely year.,129,19,3.948434985265727,True,29,2021-07-22,2021-07-22
897,Expect it,Military environment many break whole one history son teacher hotel.,129,20,2.803284547329297,True,22,2023-05-23,2023-05-23
898,Organization seem,When reveal sell dark letter since nation.,129,20,3.61933122151955,True,48,2023-11-18,2023-11-18
899,Scene,Lot suddenly perform so positive anyone economy camera rise.,129,20,4.456910575857304,True,19,2021-04-14,2021-04-14
900,Pick hope heart,Toward ready tonight nice trade citizen environmental arm now while over exist.,129,20,3.9670546081679547,True,24,2022-02-07,2022-02-07
901,Treat position top,Subject there treat toward rather good yet ability case factor.,129,20,0.8405949240508004,True,9,2022-02-14,2022-02-14
902,Pay,Need oil exactly throughout bit tonight material.,129,20,1.592295060695219,True,13,2020-07-17,2020-07-17
903,Wrong,Them image away cost need whole church prevent reason general.,129,20,0.22656048709090715,True,31,2022-06-03,2022-06-03
904,Mention,Federal first develop around our address.,129,21,3.7865243655606653,True,38,2020-10-01,2020-10-01
905,Focus director,The shake with movie ahead glass marriage charge skill create start me.,129,21,0.2247986313932615,True,24,2023-11-08,2023-11-08
906,Watch,Audience get character accept style decade.,129,21,2.0758664774109477,True,9,2020-02-09,2020-02-09
907,Next,However final next other perhaps see child activity.,129,21,0.9878663993263548,True,29,2023-09-15,2023-09-15
908,Turn,Congress forward kind notice fund pretty together bill nearly you yard.,129,21,3.901426567989522,True,14,2021-11-02,2021-11-02
909,Result,Himself surface exactly capital describe six then.,129,21,0.055743554291811104,True,22,2021-09-03,2021-09-03
910,Popular product cost,Table live give doctor director tree two manage subject book catch economic interesting.,129,21,3.0782265442574968,True,28,2021-05-29,2021-05-29
911,Many business,Daughter official certain value actually security good turn receive record conference series.,129,21,3.0727198036594636,True,47,2022-01-15,2022-01-15
912,Write amount,Appear deep cover back affect building them blood.,129,21,0.929361777580277,True,21,2021-08-26,2021-08-26
913,Reduce worker style though,Nation edge late image interesting head several toward explain.,129,23,3.9742351551360224,True,48,2021-11-28,2021-11-28
914,Attention soon,Decade special box energy rise program long according open.,129,23,4.025089456362621,True,22,2020-12-22,2020-12-22
915,That food computer remember ever,Woman have occur last college generation.,129,23,0.4035681288372861,True,40,2020-08-22,2020-08-22
916,Someone,Language foot consumer beautiful probably military speech.,129,23,4.558681025163455,True,30,2022-01-01,2022-01-01
917,Dark brother,Positive which understand nature pressure avoid continue.,129,23,3.857840458670476,True,28,2022-12-31,2022-12-31
918,Close,Employee authority season within member site sometimes heart walk.,129,23,4.9031200659301915,True,21,2022-08-25,2022-08-25
919,Once,Perhaps impact which hand clear dream send happen hit alone move.,129,23,0.47162720177505,True,31,2020-10-09,2020-10-09
920,Environmental spring always,Career doctor before also Democrat move future there edge want management apply main.,129,23,3.33739651979923,True,28,2022-11-23,2022-11-23
921,Account rock wonder ten,Consider middle probably check you admit wish rise red information able east.,129,24,4.188813603282455,True,44,2020-06-21,2020-06-21
922,Threat hundred effect,Society difference design high create learn edge suddenly Congress condition.,129,24,0.6972630294929977,True,41,2021-05-01,2021-05-01
923,Item type we,Tell member two help treatment seven.,129,24,3.6325797447674946,True,38,2022-07-14,2022-07-14
924,Pull economic,Fill chair low outside either force step she face.,129,24,3.0672165575234,True,38,2020-10-27,2020-10-27
925,Whatever test break scientist,Standard carry their land special while.,129,24,3.1664291105382865,True,33,2021-07-22,2021-07-22
926,Opportunity,Environmental special leave rise company garden once provide could than better someone.,129,24,0.9209706318611216,True,47,2021-05-19,2021-05-19
927,Most,Wear window evening including style responsibility sing quickly second.,129,24,4.330367464278984,True,29,2020-01-21,2020-01-21
928,Power actually,Whom pressure black fall myself week any.,129,24,4.833590154534703,True,29,2020-02-11,2020-02-11
929,Politics according health market star,Top ask sea focus building camera common democratic agreement foreign.,129,24,2.741265989623729,True,38,2020-10-01,2020-10-01
930,Debate,Provide movie home create management very.,129,27,0.4397572676393635,True,48,2020-02-23,2020-02-23
931,Democratic,West candidate note discover eye something will bill.,129,27,1.5529178095391467,True,50,2021-08-29,2021-08-29
932,Carry center area commercial,Identify body affect man the industry.,129,28,4.457296512914955,True,28,2021-08-07,2021-08-07
933,Until wrong responsibility film,Since able artist full not reason writer consider billion fish.,129,28,2.793129092484841,True,2,2023-05-01,2023-05-01
934,Identify,Away summer he player movement control who board listen heart gas notice hundred.,129,28,0.6689599723628142,True,1,2023-09-03,2023-09-03
935,Quality,Practice assume organization have type report practice either air character spring individual relationship.,129,28,3.654671176322408,True,33,2020-02-22,2020-02-22
