id,name,description,supplier_id,category_id,grade_average,is_active,brand_id,created_at,updated_at
1,Management notice since here,Start door company energy everything country western.,126,3,3.9975540767367805,True,42,2021-06-09,2021-06-09
2,Say,Too scientist employee stand writer win too instead until.,126,3,3.8951982482698417,True,9,2023-06-29,2023-06-29
3,Study act discover man,Ability who act situation well along.,126,3,4.183081701086328,True,16,2020-06-18,2020-06-18
4,Benefit,Drug Mr say let large any air language difficult direction your.,126,3,1.4609070742176156,True,14,2020-04-07,2020-04-07
5,Remain run majority pressure whom,Even under major activity start serious.,126,3,3.7151081914445534,True,23,2021-08-25,2021-08-25
6,End remember,Significant population movie century throughout center analysis system he computer political blue different.,126,3,1.624492800545569,True,10,2022-09-25,2022-09-25
7,Close tree,Natural near word arm talk kind.,126,3,1.2764451321190378,True,31,2020-01-02,2020-01-02
8,Number show relate,Early pull itself employee public successful five few movement quickly leave car.,126,3,3.4904406952816074,True,23,2023-05-09,2023-05-09
9,Look thing top,Myself star professor drop particular citizen newspaper amount drop east agreement issue.,126,4,1.6312131107204997,True,27,2020-05-16,2020-05-16
10,Difficult place much the,Actually believe white note administration should sure today international song dinner become four.,126,4,0.8056477571863196,True,48,2021-12-18,2021-12-18
11,Watch goal help high beautiful,Cold person view trade face star.,126,4,0.15862213437398076,True,19,2023-06-07,2023-06-07
12,Piece,Room scene series less need customer position wish.,126,4,2.2877334587827765,True,36,2021-09-09,2021-09-09
13,Record,Natural should young plant agreement hundred until enter.,126,4,0.6919142949540891,True,3,2020-09-25,2020-09-25
14,Interesting general,Hand approach fact language bit save four have expert catch unit left owner.,126,4,2.944568419715829,True,44,2023-03-13,2023-03-13
15,Above,So attack beyond something environment thousand.,126,4,3.1089135623080413,True,11,2021-06-28,2021-06-28
16,Social have,Fast wear about probably where early.,126,4,3.792858239653693,True,26,2023-04-27,2023-04-27
17,Ten task,Bar prove way green bar teacher same heart nearly without class community.,126,4,2.9241973792439353,True,20,2020-12-25,2020-12-25
18,Test,Carry camera girl truth before image rather.,126,4,3.7187101615539815,True,23,2023-07-17,2023-07-17
19,Key whose everything,Something case eye often room you beautiful fall up risk bill move.,126,5,2.7551178790570785,True,4,2020-07-12,2020-07-12
20,Different,Purpose concern gas Mrs whose this plan enjoy try environment strategy century.,126,5,0.3234412100727885,True,25,2021-07-13,2021-07-13
21,Leave,Street data subject baby guy pick role traditional but lawyer.,126,5,1.7504034358326703,True,2,2022-03-16,2022-03-16
22,Despite industry move about,Until share trip where fight author either cultural.,126,5,4.644214751196568,True,42,2020-12-10,2020-12-10
23,Fish yeah song,Book include strong cover defense reflect feeling together should piece happy job former.,126,5,3.381168960751682,True,31,2020-11-23,2020-11-23
24,None attorney financial,A parent candidate perform dog production test raise whole top expert blue heavy ahead.,126,5,3.2842964497334663,True,1,2023-07-18,2023-07-18
25,Arm thing,Century education research book challenge thought.,126,5,1.5984506353670707,True,32,2021-10-05,2021-10-05
26,Break cover,Either black follow about decision rest tend art where.,126,6,4.038698642005226,True,49,2022-07-06,2022-07-06
27,Name near,Pull the bank operation public movement sense him late decide along.,126,6,2.4675845052566125,True,24,2022-03-28,2022-03-28
28,International identify writer,Another guy usually wind senior like order.,126,6,1.271691263722493,True,36,2021-12-12,2021-12-12
29,Although,Young according amount growth already fall space left effort capital fall.,126,6,0.13475787157463948,True,6,2021-07-13,2021-07-13
30,Last back case,Lead adult per country poor seek Mr.,126,6,3.4186080331889013,True,12,2023-11-07,2023-11-07
31,Seem right top relationship,Girl adult public huge effect fund sure town clearly.,126,7,3.695356950313613,True,5,2023-12-21,2023-12-21
32,Now computer,News else song might kid change.,126,7,1.7855872771914327,True,46,2021-07-16,2021-07-16
33,Street lose,Animal charge line name set eye practice.,126,7,0.07533909507639158,True,42,2021-04-06,2021-04-06
34,Treatment career,Sense let see response financial citizen various low sell exist finish great.,126,7,2.5179789982213636,True,10,2023-12-22,2023-12-22
35,Maybe happy less hit down,Brother on chance question police image brother.,126,7,2.201231170437447,True,14,2020-03-01,2020-03-01
36,Leave right,Child it as attorney suggest country.,126,7,1.2876427961242287,True,43,2020-02-15,2020-02-15
37,Treatment,Father hospital try call ok involve heavy.,126,8,0.8027553979772806,True,9,2023-09-20,2023-09-20
38,Serve fish chance southern,Reduce hundred federal trouble edge enjoy.,126,8,1.2827802679765166,True,13,2022-07-05,2022-07-05
39,Such kid,Expert phone ahead occur least pretty no.,126,8,4.3491250861974144,True,20,2022-09-29,2022-09-29
40,Current I provide issue,Necessary book who performance trade woman.,126,8,1.3096116521169021,True,50,2020-09-18,2020-09-18
41,Senior,Break throughout second bill artist himself tough write beyond will hear.,126,8,2.085987471265322,True,8,2020-10-31,2020-10-31
42,Knowledge,Shoulder control military collection quickly talk.,126,8,0.11000216362628212,True,50,2020-08-05,2020-08-05
43,Market,Commercial forward stock on policy show produce.,126,8,1.398182373733417,True,42,2023-08-24,2023-08-24
44,Response,Yes standard in buy open employee not spring long front parent.,126,8,1.6322205932377614,True,43,2020-05-24,2020-05-24
45,Share,Head election dream return chair cause apply name media attention require.,126,9,1.212576057995316,True,25,2021-12-20,2021-12-20
46,Senior difference name crime,Care between every federal direction pressure.,126,9,4.376322566051668,True,2,2022-11-30,2022-11-30
47,Hard than,Material others help back west include beat factor today begin board.,126,9,1.5304732843984032,True,1,2020-09-22,2020-09-22
48,Exactly figure rich,About surface worry ten need only general sell kid.,126,9,3.6053611380097186,True,31,2021-03-17,2021-03-17
49,Morning,Remember same within particularly travel watch can check later interest.,126,10,4.06525960484621,True,42,2022-10-07,2022-10-07
50,Will pull investment,Tax project skin appear thing realize letter Democrat who recent pass.,126,10,1.78653093493323,True,40,2020-07-10,2020-07-10
51,Nature,Step thing film send either ok white beyond character step however.,126,10,0.540219059645039,True,25,2023-11-27,2023-11-27
52,Fine us hard continue so,Order fire letter plan floor Republican beyond one popular ask floor may.,126,10,3.5953294904452653,True,43,2022-09-09,2022-09-09
53,Finally,Look figure somebody good threat able get specific poor.,126,10,0.8077389491561204,True,22,2023-05-21,2023-05-21
54,Group order,Century meeting system smile identify police including sure cut study from do administration.,126,10,0.64766407472505,True,22,2023-01-30,2023-01-30
55,Contain either like,Control in then life score inside standard.,126,10,4.842677604805745,True,41,2020-05-11,2020-05-11
56,Visit evidence,Arm hand learn use care half present light make fight per.,126,10,1.5347112686012931,True,16,2023-07-03,2023-07-03
57,Inside where,Face consider industry various quickly art baby serve office dinner change share over.,126,10,4.395338516348032,True,5,2022-11-22,2022-11-22
58,Hard,Dream unit offer feeling nation stock first by generation east strong north area.,126,11,2.568305642030034,True,29,2023-09-10,2023-09-10
59,Behavior reflect team,Point hospital good prepare carry decision scene protect.,126,11,2.8909867523770627,True,21,2022-01-05,2022-01-05
60,Artist,Themselves create upon name population adult stay scientist produce fly.,126,11,0.6992587273550865,True,46,2022-01-03,2022-01-03
61,Central,Radio son care watch soldier argue necessary.,126,11,0.5682526708684793,True,33,2022-02-15,2022-02-15
62,Risk,Various his ever condition exist movie class early wide star traditional watch land.,126,11,1.8525051289415195,True,5,2020-08-07,2020-08-07
63,Stock money,Charge point system model could whether feel environmental election task big.,126,11,1.3170492431156693,True,10,2020-02-20,2020-02-20
64,Ground,Sound establish second letter court when.,126,12,0.19207068002398353,True,31,2023-01-24,2023-01-24
65,Ball development plan floor,Wish effort them pay doctor yes choose million travel.,126,12,1.4256215400092176,True,13,2022-12-13,2022-12-13
66,Say,Executive everyone course decision movie city treat soon nature better trip full themselves.,126,12,4.743475832611056,True,43,2020-01-29,2020-01-29
67,And federal,Before resource system make white beyond actually international energy city send character range.,126,13,2.8628367080734183,True,41,2022-02-12,2022-02-12
68,Whether player hard,Gas serve lead fall concern throughout cultural process on available section call information.,126,13,2.2266804622545884,True,34,2021-01-15,2021-01-15
69,Money,Black law necessary note church support weight Mr bed.,126,13,1.2644651008347458,True,44,2022-01-14,2022-01-14
70,Why chance girl line remain,Try economy morning recently cut significant what if his force few money physical.,126,13,0.9823845375988477,True,25,2023-12-25,2023-12-25
71,Against vote,Response modern only minute this perform dog really focus.,126,13,2.842142221350414,True,27,2022-08-23,2022-08-23
72,We,Present first whether offer daughter product sound human girl strong.,126,15,3.5598980386729417,True,28,2020-05-25,2020-05-25
73,Lay animal,Pattern someone information act owner at theory task term natural expert.,126,15,0.27474143557478237,True,24,2021-03-14,2021-03-14
74,Brother,Property under attorney sell daughter region kitchen such east cell eight western.,126,16,3.0739474325043203,True,15,2021-06-11,2021-06-11
75,Or seven doctor,Fast food myself also rule financial.,126,16,0.24580188381730816,True,39,2020-09-24,2020-09-24
76,Apply,Item region seat generation detail fine already back both easy.,126,16,0.10713283430108744,True,34,2023-10-04,2023-10-04
77,Happen,Scene mission question might reach among serve lawyer.,126,16,3.2808134661755566,True,13,2020-01-26,2020-01-26
78,According,Long hit guy by from kid through job once party protect.,126,16,1.8586427127211897,True,34,2023-05-15,2023-05-15
79,Scene thank consider,Research pick husband add reality skill consider about prove increase so.,126,16,2.603287606030707,True,28,2022-05-21,2022-05-21
80,Late staff help,Walk sister quality third simply daughter citizen political.,126,16,4.01967850402263,True,27,2020-08-06,2020-08-06
81,Series important,Service west a test knowledge sport two some control around attorney wide next.,126,16,1.8528340588344543,True,33,2023-10-09,2023-10-09
82,Lay key wife training,Movement station matter exactly entire pick radio student professional war I.,126,17,0.5128315004856254,True,30,2020-10-24,2020-10-24
83,Technology light research together I,Decision from cultural born read state go source card view.,126,17,4.693988171892761,True,14,2021-09-09,2021-09-09
84,Ok,Author painting nature no growth hard attorney upon citizen performance campaign rule.,126,17,1.2930538786206074,True,10,2023-06-10,2023-06-10
85,Yet itself in likely,Contain give himself develop major police age.,126,17,1.3837451601754407,True,9,2020-05-08,2020-05-08
86,Bit,Late experience behavior draw teacher image position send might candidate within huge.,126,17,2.8223223548777043,True,6,2022-02-24,2022-02-24
87,Green behind,Now a although argue world particularly drug describe include news.,126,17,0.7169324725817006,True,29,2020-11-30,2020-11-30
88,Home,Stage later detail wind top anything might.,126,17,1.3973950840956995,True,28,2022-02-26,2022-02-26
89,Nothing training tonight southern,Movie wind program together create total customer day.,126,17,3.9839956857950725,True,28,2021-10-30,2021-10-30
90,Improve nothing risk never around,Everything most rock brother push conference thought and nation upon girl control message.,126,17,3.2667454556752142,True,30,2022-08-13,2022-08-13
91,According,Degree level writer police apply maintain threat out during tell mission trial call.,126,18,4.183136203894092,True,18,2022-07-09,2022-07-09
92,Newspaper difficult woman,Police when water call dog affect it wonder lawyer specific fire any.,126,18,4.737612768582933,True,46,2022-06-19,2022-06-19
93,Machine hour find though fact,Involve oil must until decide size hair month safe local.,126,18,4.927944580810716,True,45,2022-06-24,2022-06-24
94,Lawyer name,Few reach feel sit senior hard establish away national time song PM.,126,18,0.11172302672376955,True,10,2023-07-31,2023-07-31
95,Total,Unit goal tonight challenge them ball happen senior.,126,18,1.0253015438581992,True,9,2021-02-23,2021-02-23
96,Pay experience which,Task apply nice environment method usually two surface know on go then unit.,126,18,0.24417844307569048,True,10,2021-07-04,2021-07-04
97,Look,Would rise which end mention stuff the war wrong interview soldier economy floor.,126,18,4.801910933548309,True,11,2022-09-27,2022-09-27
98,Door industry,Quite newspaper recognize human huge economy who my.,126,19,1.1456715232312114,True,13,2021-07-10,2021-07-10
99,Understand,Contain red final happen democratic claim place all wrong.,126,19,4.892822507441393,True,2,2020-09-15,2020-09-15
100,Development product,At even if government need image eat bit strategy east.,126,19,2.6918743906979463,True,10,2023-08-25,2023-08-25
101,Project push,Population almost wrong difference approach serve take own whose weight.,126,19,3.318807002579484,True,32,2023-02-16,2023-02-16
102,Can rich article,Big entire short return energy use activity ahead key day employee.,126,19,1.652120555666741,True,15,2023-12-11,2023-12-11
103,Subject,Serve character some trouble yourself present both their put case indicate these.,126,22,0.43588287824091687,True,49,2020-08-12,2020-08-12
104,Bed hand raise,System matter along have institution price instead environmental kind drive matter individual.,126,22,1.099274266288071,True,40,2020-07-11,2020-07-11
105,Building young,Explain college buy sense husband sea heart somebody arrive trouble rock little end.,126,22,1.7496804088224556,True,9,2021-10-02,2021-10-02
106,Parent,Sister baby building stock relationship response site similar center.,126,23,1.9830147460980252,True,40,2020-01-17,2020-01-17
107,Four subject learn eat use,They once who need garden baby individual particular TV threat expect door.,126,23,0.9171312841072482,True,28,2021-03-23,2021-03-23
108,Fund,Size real as marriage create law.,126,23,0.6628412202831813,True,27,2021-08-03,2021-08-03
109,Court discover,Explain citizen wife never growth certain before fund citizen politics son.,126,23,3.7207138622482816,True,42,2022-07-05,2022-07-05
110,Never future language,Seek charge special explain resource Congress discussion represent.,126,23,2.1680622844293964,True,13,2020-12-26,2020-12-26
111,Budget watch particular game,Magazine attorney laugh week around police edge example.,126,23,2.3899263520692116,True,10,2020-05-05,2020-05-05
112,Imagine,Beat camera city game group expert hit address born add into.,126,23,1.1638507395392172,True,37,2022-07-10,2022-07-10
113,South her,No knowledge face attack network later including week country page party.,126,23,2.1407017398053867,True,19,2021-04-02,2021-04-02
114,Sport business,Sea memory space machine away quality her western.,126,24,0.881629226715584,True,6,2021-06-29,2021-06-29
115,Perhaps,Age each debate generation bad soon perhaps turn fish everybody.,126,24,4.535882649408434,True,1,2023-06-10,2023-06-10
116,Group tax lose every quality,Evening more option responsibility break himself man table yard.,126,24,0.798508906208733,True,46,2023-07-25,2023-07-25
117,General threat radio everybody,Focus memory there your public laugh police ready computer.,126,24,1.9392514617500534,True,18,2020-06-28,2020-06-28
118,Individual,Type win through conference partner participant happy.,126,24,3.8119039450860743,True,19,2020-05-24,2020-05-24
119,Garden bring,Move why age direction out available hope wait common.,126,24,2.9533614727286244,True,45,2020-06-07,2020-06-07
120,Contain,Figure organization eat later she middle consumer.,126,24,4.770526171811501,True,3,2021-09-22,2021-09-22
121,Environment visit,Health become degree owner wall west operation.,126,27,1.3177528065162987,True,38,2021-11-01,2021-11-01
122,Dark,History upon magazine store guy kitchen against song everybody seek concern cup.,126,27,0.3879889783467855,True,19,2023-09-19,2023-09-19
123,Technology,Finally which mean example more go fact myself he feeling face sit material.,126,27,4.401715978371792,True,25,2021-02-26,2021-02-26
124,Really,Character gun entire win form home you any.,126,27,0.36804596091956354,True,24,2022-08-19,2022-08-19
125,According,Article such tend mission war arrive.,126,27,0.3004096331743622,True,36,2022-07-22,2022-07-22
126,Rock,Report morning opportunity building support hundred.,126,27,4.119288097505574,True,42,2021-04-03,2021-04-03
127,Information,Institution model compare game save trip job shoulder.,126,27,4.4198134918600775,True,36,2020-01-14,2020-01-14
128,Whom specific every cultural,Myself manage month medical again positive current day suffer low read religious investment.,126,27,3.555195422270527,True,31,2021-08-11,2021-08-11
129,Throughout town,Indeed impact little scientist open left represent general pay Mr.,126,28,2.515443502205134,True,36,2023-09-16,2023-09-16
130,Easy,Quickly specific cut part treatment though read former property lay behavior challenge.,126,28,3.882746640858456,True,33,2020-09-19,2020-09-19
131,Possible candidate worker,Bring sister attorney as task report it prevent.,126,28,4.814431725509218,True,49,2023-11-22,2023-11-22
132,Chair ask network,Example last mother ago arm like foot last trip mouth husband.,126,28,0.7589524157652261,True,45,2022-08-20,2022-08-20
133,Someone,Customer book usually point account speak management international economic.,126,28,0.7602010858430597,True,35,2022-12-18,2022-12-18
134,Light,Box before some strong type practice blood relationship nice morning sister practice.,126,29,1.09088091939689,True,8,2022-08-27,2022-08-27
135,Wonder,Start never ago writer accept really reflect next news skin.,126,29,1.4590060261746336,True,50,2021-02-25,2021-02-25
136,Its support,Enough kind all well author size dog weight establish last add action where.,126,29,0.2523645711548117,True,1,2022-03-15,2022-03-15
137,Community,Institution police player design law particular region local create however scientist.,126,30,4.263932606247034,True,19,2020-10-14,2020-10-14
138,For,Debate little sure century about listen evidence.,126,30,1.6109238543897797,True,14,2022-06-21,2022-06-21
139,Approach,Type health into assume management collection culture mother family house however.,126,30,4.196590898557474,True,39,2022-04-10,2022-04-10
140,Explain,Total rate country again dream kind they wrong position black.,126,30,3.269446024490631,True,41,2020-09-09,2020-09-09
141,Life,Thousand language sing individual debate less white per production follow.,126,30,4.04145896997173,True,30,2020-08-24,2020-08-24
142,Stand,Summer him little candidate lawyer watch teacher phone generation thank.,126,30,4.399317153795815,True,1,2022-10-03,2022-10-03
143,Bad establish,Ability strong call various effect western baby too church month door toward oil.,126,32,2.2137774644427832,True,39,2022-07-28,2022-07-28
144,Industry white,Without current agree late ball show interesting team mission between mother charge site.,126,32,3.1629908806932767,True,13,2021-12-11,2021-12-11
145,Hope until black might,Senior seem hard small test painting experience.,126,33,4.3551875147109165,True,24,2023-02-24,2023-02-24
146,Fine card,Same country will study approach soldier travel back.,126,33,2.415942022402366,True,36,2022-08-03,2022-08-03
147,Fear,Form civil tough class somebody pattern consider describe keep miss federal people.,126,33,0.6356607486123922,True,47,2023-04-06,2023-04-06
148,National gun us space,Follow arm born economy carry store bar build far PM team left more.,126,33,2.7471287261772237,True,36,2023-06-27,2023-06-27
149,Smile unit,Focus heart between boy career ago value record talk middle.,126,33,0.7316131866899017,True,36,2023-08-10,2023-08-10
150,Check black east,What strategy north nor have own peace American learn media.,126,33,0.57387432356163,True,25,2023-09-14,2023-09-14
151,Room coach while,Exist capital drug talk room themselves probably leave whose worker.,126,33,3.1477304262095744,True,1,2020-02-07,2020-02-07
152,Tax garden,Half both technology outside close current finally city need maybe suggest wait win third.,126,33,1.045485825254742,True,9,2021-04-27,2021-04-27
153,About job,Sometimes music good still performance establish real get activity safe may.,126,33,1.4264411225248268,True,30,2022-08-05,2022-08-05
154,Want against a,Heart various set Republican really color product security career design let model energy.,126,34,4.570114899858694,True,25,2023-07-28,2023-07-28
155,Yard,Back attack must lose reflect our.,126,34,2.100789138535015,True,33,2021-11-13,2021-11-13
156,Minute free phone,Capital woman word general record despite pick stock say impact after or lawyer.,126,34,2.757313860392943,True,38,2022-01-16,2022-01-16
157,Back section,Hear positive thought debate education along within professor how would family.,126,34,3.9117915704104007,True,6,2021-10-10,2021-10-10
158,Republican,Yet face level mother field law provide consumer range TV.,126,34,0.42673904388787987,True,47,2022-03-09,2022-03-09
159,Style letter anything remain,Throughout side great central quite involve space often up performance suddenly.,126,34,3.209710550464893,True,3,2021-12-19,2021-12-19
160,Father,Create government out five those bag someone drop real seek late open size.,126,34,3.8563002433552236,True,42,2023-10-13,2023-10-13
161,Nation,Several boy trip stage pattern address condition performance dog ability ok above need.,126,34,0.9759621447254319,True,40,2022-06-23,2022-06-23
162,College,After bag represent exactly memory ago instead article young.,126,34,4.973654503817341,True,32,2020-10-19,2020-10-19
163,Rock around,Down skin gas race such deal determine tax.,126,34,3.4953503696914656,True,49,2020-10-14,2020-10-14
164,Loss free,Say mother happen customer poor through between.,126,35,4.472515115566419,True,26,2022-03-08,2022-03-08
165,What easy challenge eight,Too break green adult anything level.,126,35,4.457256188063494,True,9,2021-03-26,2021-03-26
166,Why,Finally country face little third general get might same hold anyone own actually.,126,36,0.3277882276045585,True,1,2023-01-01,2023-01-01
167,Very,Amount especially kind free degree including.,126,36,4.154054551428158,True,27,2023-04-16,2023-04-16
168,Summer west,Stay meet red since note meet field health.,126,38,4.832709590446644,True,37,2021-03-31,2021-03-31
169,White take charge,Anything half fear idea person oil fine assume institution thousand water.,126,38,0.35613134523470313,True,19,2020-02-26,2020-02-26
170,Democratic season compare change bit,Option matter summer office describe even nation message.,126,38,1.6587845995887596,True,32,2021-10-18,2021-10-18
171,Information help kitchen whether dream,Job offer character again high miss any by sense authority.,126,38,3.311661961802776,True,9,2020-01-21,2020-01-21
172,Cover,Get a part water pull training check lawyer yourself decision owner.,126,38,3.0958209542541164,True,18,2022-06-28,2022-06-28
173,President,Improve mind collection TV at age charge early crime build strong.,126,38,3.564725004727945,True,43,2020-08-26,2020-08-26
174,Teach,Score your stop shake expect two suddenly speech.,126,39,4.305103155366506,True,28,2023-03-16,2023-03-16
175,Sit recently,Color government suddenly less least black experience pick of ground someone trip.,126,39,3.2232039431515935,True,33,2022-04-24,2022-04-24
176,Major we rich recent change,Very song nice Mrs any federal note beat.,126,39,2.8947571792174243,True,13,2023-01-29,2023-01-29
177,Price,Book person four eight yes Mr ask fish leave admit clear reach.,126,39,4.033340184928028,True,43,2020-03-02,2020-03-02
178,Design,Local final trial whole early school hit structure despite place.,126,39,1.9212011211275504,True,29,2021-12-29,2021-12-29
179,Trip,Discussion thought drive other center next article draw president everybody when place writer.,126,39,1.0838870432544445,True,32,2021-07-18,2021-07-18
180,Light society,Hear recognize place join land senior product spend sound.,126,39,2.6113564657476966,True,47,2023-05-23,2023-05-23
181,Full management fact few,Which to everybody have report young very ok move if money.,126,39,1.4461964980716129,True,45,2022-09-30,2022-09-30
182,Despite,Weight travel whatever blue recent husband item family network degree among economic cell.,126,39,2.1624481875286214,True,40,2020-01-24,2020-01-24
183,Energy direction participant,Throughout somebody himself hundred back safe trade here sit hair already yet notice.,126,39,4.989255786922092,True,12,2023-07-13,2023-07-13
184,Threat,Child best building trial develop need themselves.,126,40,0.602090254616085,True,32,2020-02-15,2020-02-15
185,Agent think,Program lead language compare finally certainly worry that world a describe social.,126,41,3.8112069068678807,True,32,2022-09-17,2022-09-17
