id,name,description,supplier_id,category_id,grade_average,is_active,brand_id,created_at,updated_at
936,No hour main around,Keep figure chance entire kitchen important with financial dream look sport.,129,28,3.6282811341317616,True,5,2020-05-17,2020-05-17
937,Perhaps sometimes hot follow,Walk someone even individual concern free class four then reduce.,129,28,2.0288697472347357,True,37,2022-10-03,2022-10-03
938,Discussion find,Picture middle her here similar within technology back sea much.,129,28,2.9193651488710537,True,18,2022-04-03,2022-04-03
939,Increase,Huge forward question though term democratic way give.,129,28,0.09724225391724295,True,20,2023-04-20,2023-04-20
940,Speak,Remember loss movie war officer age goal open huge total eat add general.,129,29,1.0192024233919335,True,29,2023-04-16,2023-04-16
941,Draw represent,Finally last reality yes science sit town movie government.,129,30,0.5339689429891908,True,13,2022-10-07,2022-10-07
942,Development,Money mother skin year lose call law.,129,30,3.894700814833529,True,50,2020-05-21,2020-05-21
943,Meeting grow him collection,Yourself step everyone perhaps step significant.,129,30,2.374103632949808,True,27,2021-07-06,2021-07-06
944,Option really,Subject too either administration authority position scene hand require well few raise.,129,30,2.0512510714588608,True,36,2021-10-08,2021-10-08
945,Plant,Assume card worry sometimes many pretty Democrat cause.,129,30,4.122281857533682,True,2,2020-10-19,2020-10-19
946,Success,Including somebody miss style involve vote wrong scene daughter more suffer join.,129,30,1.3417180601600542,True,20,2021-08-16,2021-08-16
947,Special,That thousand different perform policy place perhaps end hard.,129,30,4.733152056326419,True,37,2023-09-17,2023-09-17
948,Our off,Enter collection take now same water toward anything own general.,129,30,0.5435597485876192,True,29,2022-05-12,2022-05-12
949,Government another,Thing including wife strategy without remain sea force say check.,129,31,3.7869134530907305,True,39,2021-04-04,2021-04-04
950,Step fall conference,Truth prevent compare yourself among modern involve mention.,129,31,4.406158902942653,True,4,2020-07-28,2020-07-28
951,Discussion sport,Relate politics foreign leader factor agreement professor floor course easy performance wall behind.,129,31,2.0349098153788563,True,40,2020-06-01,2020-06-01
952,Hand arm,Environmental kind hotel explain conference fast admit.,129,31,3.4666754824586383,True,39,2021-06-18,2021-06-18
953,Available community,Mouth popular class under red from what project back whole.,129,31,2.0775836951691504,True,46,2020-08-27,2020-08-27
954,Somebody none ask,Direction image treatment program red culture indicate eye three.,129,31,4.031716262561039,True,22,2021-05-17,2021-05-17
955,Cost,Pass cover performance great happen throughout call ask wind shake picture ahead.,129,31,1.0271219993894949,True,12,2023-10-18,2023-10-18
956,Tend,Not power best individual wear Republican seek over main check.,129,31,1.3505833645731173,True,8,2021-11-28,2021-11-28
957,Congress,Put prepare if wear arm data have enough.,129,31,4.863786236571789,True,44,2023-08-30,2023-08-30
958,Fight,Light memory group less cell challenge there card view movement else.,129,31,3.5899841565079265,True,30,2020-10-21,2020-10-21
959,Since step spend center tonight,Act attorney mind oil similar when.,129,33,4.556084198177961,True,35,2022-09-25,2022-09-25
960,Central sit,Development method get painting fight audience share base foreign allow week four say.,129,33,4.544111208484763,True,36,2021-10-12,2021-10-12
961,Thank,Along it deep their southern fact product.,129,34,4.506932200404867,True,24,2020-02-01,2020-02-01
962,This,Cultural water someone he alone necessary former film ground but meeting.,129,34,1.8039305272786144,True,12,2020-07-11,2020-07-11
963,Address eight whether,Team radio window final city happy.,129,34,0.23069915745624447,True,3,2021-03-19,2021-03-19
964,Other,However quality great process American program baby lawyer manage interest agent item no.,129,34,3.0623964128628427,True,42,2020-03-28,2020-03-28
965,Born consider put begin program,Tell edge fear happen history study return free enjoy big interesting return.,129,34,2.736537137354571,True,45,2021-03-27,2021-03-27
966,Husband,Republican girl someone director enjoy Mrs loss ago father character assume garden.,129,34,3.6554601288363067,True,12,2022-03-05,2022-03-05
967,Some,Important certain they study government record get hot money.,129,34,2.8001411397960805,True,45,2023-07-02,2023-07-02
968,Phone,Key case player car source value range house myself important.,129,34,0.2664330942999832,True,19,2022-05-06,2022-05-06
969,Cause,Air have speak who within hundred claim so summer start factor about.,129,34,2.8209492793319404,True,31,2022-09-05,2022-09-05
970,Growth country,Push example yes whether opportunity campaign interest stage.,129,34,0.860693678044005,True,2,2020-11-09,2020-11-09
971,Challenge,Try too number company and feeling job throw process science six yourself.,129,35,2.5997158878222355,True,34,2020-03-26,2020-03-26
972,Answer,Wife image article far hold next campaign detail morning its account last its.,129,35,3.369161928392263,True,28,2020-11-10,2020-11-10
973,Development tough ok,Away size on win power summer between fund born theory.,129,36,1.2177925324477845,True,17,2023-06-29,2023-06-29
974,Executive give run seem approach,Because often hand safe wait change professional often cultural least three authority.,129,36,2.8537228447068506,True,32,2023-03-19,2023-03-19
975,Within,Discussion book camera develop according difficult Mrs represent.,129,36,0.35454000833618105,True,25,2020-01-13,2020-01-13
976,Use,Coach again husband be necessary magazine save good voice.,129,36,1.849220498963155,True,23,2022-03-18,2022-03-18
977,Manage,Despite sure state almost wife write on political control not yourself question.,129,36,1.4523571771585768,True,10,2020-03-08,2020-03-08
978,Case,Response maintain heart really audience early total building scientist mission plan sea quite.,129,38,2.908059004011578,True,48,2021-10-31,2021-10-31
979,Movement key age,Miss out big fly sometimes meet tell power social six several.,129,38,0.6815496789536141,True,7,2021-09-09,2021-09-09
980,Morning six believe blood she,Grow bit yourself painting big stop game.,129,39,0.10807853866257211,True,20,2023-10-23,2023-10-23
981,Open cell customer his,Always pay win education more choose hair animal condition explain understand vote.,129,41,4.854663735489237,True,50,2021-10-15,2021-10-15
982,Time,Newspaper answer voice find animal process.,129,41,1.059372816097948,True,34,2023-02-12,2023-02-12
983,Take,Dream send blue or right military agreement order bank present.,129,41,4.181035597426001,True,20,2022-10-28,2022-10-28
984,Interest,Thing also fear hand your public hour account organization.,129,41,3.383428026398442,True,45,2023-02-27,2023-02-27
985,Today represent,Former for ago every perhaps year sea north structure spring take.,129,41,3.718607669597574,True,29,2023-05-11,2023-05-11
986,Not positive,By more level win might protect child.,129,41,3.3809368855300113,True,47,2023-07-29,2023-07-29
987,Direction similar black middle,Country wind may foot live area race.,129,41,4.73679143733475,True,30,2022-02-10,2022-02-10
988,Smile,Clear capital president east positive nearly room field agency resource.,129,41,2.6944624918983227,True,48,2022-07-31,2022-07-31
989,Talk,Conference other executive song gas them eat.,129,41,2.648341356344648,True,30,2020-10-28,2020-10-28
990,Street goal drop,Dark company operation simply plan box nice think fact.,129,41,4.013385130442156,True,45,2021-10-04,2021-10-04
991,Own recently heavy,Organization southern develop store size growth much.,129,42,4.050962471473837,True,24,2023-03-12,2023-03-12
992,Because even foot,Every serious method source choice political.,129,42,1.5475811999705813,True,10,2022-03-03,2022-03-03
993,Now week,Although surface truth support threat mention high Democrat out measure maintain mind friend.,129,42,1.5187031587411437,True,17,2022-12-08,2022-12-08
994,South,Thus company just audience prove issue response edge feel buy writer issue.,129,42,3.831258710509568,True,10,2022-09-15,2022-09-15
995,Different candidate,Box easy manage use my reality.,129,42,2.1406164219324624,True,29,2023-04-03,2023-04-03
996,Value include foreign safe,Of general campaign move plan here particularly hard author one positive speak.,129,42,2.9097116285986777,True,14,2021-01-14,2021-01-14
997,Develop method effort common,Any week population lawyer personal old view.,129,42,1.8659583662820534,True,48,2021-11-13,2021-11-13
998,Visit local,New think other return product our behind style anyone because thus traditional offer.,129,42,3.1943996328192314,True,41,2020-05-01,2020-05-01
999,Maybe,Should represent not poor among drop like through mother deal.,129,42,2.1317450515571594,True,22,2022-11-04,2022-11-04
1000,Throughout,Bed TV information those while consider stand modern.,129,42,4.849493201270131,True,1,2021-11-10,2021-11-10
1001,Table,Measure TV movement decade view protect player relationship ever.,129,43,2.969038613416197,True,48,2023-09-20,2023-09-20
1002,Media,Scientist carry office black middle born six inside.,129,43,4.714340768191577,True,50,2020-01-11,2020-01-11
1003,West their natural,Boy early raise interview over notice should himself order great difference now ball.,129,44,3.263734170422323,True,17,2022-01-12,2022-01-12
1004,Among collection trade,Listen check leave list entire become describe.,129,44,0.30845619280810754,True,32,2021-10-09,2021-10-09
1005,Always,However answer support travel heart possible office.,129,44,4.527285735441227,True,2,2022-08-05,2022-08-05
1006,Author represent visit art,Purpose argue week at in under blood coach none candidate clearly different medical.,129,45,2.6179843439591193,True,11,2023-03-29,2023-03-29
1007,Scientist traditional sort,Model job you strategy recognize race view draw nice Republican law civil federal.,129,45,0.6443566869356016,True,18,2021-02-25,2021-02-25
1008,Watch,Relationship recent during trip dog be television on visit view serve.,129,45,3.923714200055994,True,6,2021-01-17,2021-01-17
1009,Simple,Responsibility dog wind peace toward billion administration response fear mouth science.,129,45,1.7531824458092475,True,16,2020-07-08,2020-07-08
1010,Tv affect,Rich note perform moment about figure yes see serious.,129,45,1.9868660787468206,True,3,2022-05-09,2022-05-09
1011,They,House civil marriage none protect institution.,129,45,3.477516119420767,True,46,2023-06-24,2023-06-24
1012,Talk big,Talk information national job idea structure development question paper unit hundred population thousand.,129,45,4.685580991562042,True,18,2023-01-07,2023-01-07
1013,Occur,Space establish at day activity month reduce trade.,129,45,4.338634335531996,True,47,2023-07-03,2023-07-03
1014,General memory water,Want citizen front professor before huge finish information.,129,46,2.8768600509002007,True,49,2022-04-15,2022-04-15
1015,Cup approach,Detail land best development myself how general open everyone serve necessary difference week up.,129,46,0.01720516385158244,True,9,2023-11-22,2023-11-22
1016,Common,Theory successful maybe lead service this shoulder cultural option produce.,129,46,4.713913699923811,True,18,2023-05-12,2023-05-12
1017,Current quite plant,Who agent indeed late money drug each style establish agree.,129,46,2.675101059224838,True,18,2023-04-20,2023-04-20
1018,Population change play security,Later whatever experience wait book draw commercial exist contain strong PM.,129,46,4.915164599133529,True,44,2022-11-20,2022-11-20
1019,Sort,According team rule candidate particularly majority attorney.,129,46,2.8226444653402156,True,19,2021-03-08,2021-03-08
1020,Attorney carry,Term rise resource much she religious.,129,46,1.9622898591192945,True,31,2022-11-21,2022-11-21
1021,Western,Onto list campaign sort Republican head camera yet small price detail challenge enter.,129,46,2.807704170517555,True,23,2022-01-21,2022-01-21
1022,Century central detail,Vote ago almost modern culture evidence run experience number scene main.,129,46,0.08829046663880957,True,17,2020-08-19,2020-08-19
1023,Check,Marriage dream six boy before high wait international save argue possible.,129,46,1.0470159412736435,True,17,2021-01-16,2021-01-16
1024,Trade feel player mean heavy,South call maybe can player thank gun perhaps side new.,129,48,3.620590716907221,True,23,2020-08-10,2020-08-10
1025,Matter hotel yeah also,Believe rock whom father claim everything your much put still religious her know.,129,48,4.855297948046374,True,10,2023-08-26,2023-08-26
1026,How role kitchen,Continue threat them her provide quickly town today ten.,129,48,3.0908357359264116,True,3,2020-07-05,2020-07-05
1027,Strategy continue,Benefit would bad example but best.,129,48,3.5851355657900092,True,30,2020-06-28,2020-06-28
1028,Today direction forward,Thought against consider brother fact matter position each value impact head money.,129,48,0.2870769265371287,True,46,2021-03-17,2021-03-17
1029,Artist much bill ok,The set guy surface know hope.,129,49,4.622219787582198,True,29,2021-02-23,2021-02-23
1030,What behind yet then,Claim anything smile enough task consider course white though risk body five raise.,129,50,1.2755368188753968,True,50,2022-02-24,2022-02-24
1031,Ever site,Leader thus control organization team cut environment vote black.,129,50,0.5097998848094382,True,33,2022-01-29,2022-01-29
1032,Anyone model,Recently not need still radio expert model to above pretty factor although we nothing.,129,51,4.7467430607059224,True,42,2023-12-19,2023-12-19
1033,Line,Run parent stand safe single material life message machine.,129,51,4.428763426291109,True,30,2021-05-01,2021-05-01
1034,Author let,Effect low something place drug positive friend accept easy land.,129,51,3.5508092776965046,True,35,2021-08-14,2021-08-14
1035,Leader,Space stage few adult partner national public sometimes travel wall identify media key.,129,51,2.108065713208841,True,26,2023-07-26,2023-07-26
1036,Condition town four,Dinner crime establish must drug soldier.,129,52,3.296079782085627,True,3,2022-11-08,2022-11-08
1037,Daughter,Near garden hold big away else.,129,52,1.7287177639529872,True,27,2021-06-20,2021-06-20
1038,Sister in list,Just fear high article go city.,129,52,4.668381385970855,True,3,2023-06-05,2023-06-05
1039,Language sing note happen,Their wrong price skill most report several late general step old long.,129,52,0.6226546548361572,True,19,2021-03-31,2021-03-31
1040,President every clear,Technology dark audience our oil here group federal else happy.,129,52,2.0109139290078937,True,35,2020-06-05,2020-06-05
1041,Woman short,Clearly bad unit each single career.,129,52,2.789769984840263,True,15,2021-10-17,2021-10-17
1042,Event computer range,Kitchen kitchen behavior on never hospital bed.,129,52,3.2831525304936475,True,43,2020-02-18,2020-02-18
1043,Do,Tv strategy level bit fish sit type voice our traditional detail finish too memory.,129,52,2.148282536445154,True,6,2020-05-23,2020-05-23
1044,Understand money several small,Your develop purpose pull any away air so research interesting short kid.,129,52,2.215935207193181,True,47,2020-02-12,2020-02-12
1045,Discuss region of,They provide method boy need early yeah.,129,53,1.0821457180377547,True,3,2023-10-18,2023-10-18
1046,Forget,Reality exist get whose learn street.,129,53,4.5225481157871,True,47,2021-12-23,2021-12-23
1047,Sport season,Assume laugh day call hospital from candidate down customer around fund.,129,53,1.8569039414919986,True,27,2023-04-11,2023-04-11
1048,Or,Save form or true owner room stuff financial treatment price example drug water.,129,53,3.5513322756418657,True,45,2023-12-16,2023-12-16
1049,Member very hand talk,Address order pattern meeting ask find consumer key agree whole stock.,129,53,1.1202035056841242,True,43,2022-10-15,2022-10-15
1050,Bed happen fill discussion,After article success visit base day hospital forward tonight feeling scene way.,129,54,1.6799106075746006,True,5,2023-12-01,2023-12-01
1051,Game under,Care environment after financial face organization order bit education development movement ball later.,129,54,2.547301239147303,True,21,2023-09-16,2023-09-16
1052,Writer,Bar with hard grow allow moment final behind same ever ago.,129,54,0.9682620504210715,True,27,2023-06-12,2023-06-12
1053,Bar campaign,Black technology situation thank method knowledge.,129,55,2.0620608608503996,True,19,2022-07-24,2022-07-24
1054,Change hour approach bring save,Finally foreign power thing available method voice too view trade.,129,55,4.1419935899680445,True,29,2022-09-03,2022-09-03
1055,Simply,Reality TV never science how live.,129,55,0.5413025402960903,True,4,2022-04-30,2022-04-30
1056,Fact red we,Really news create such spring his official try perform born eight.,129,55,0.1362239464050291,True,21,2022-07-15,2022-07-15
1057,Be ball travel,Night record produce painting score meeting tough here million house food the window.,129,57,4.081365576658072,True,40,2023-11-26,2023-11-26
1058,Middle site ten,Trouble fight whom quickly case structure home specific daughter establish and outside these say.,129,58,1.8284259064619457,True,46,2023-05-02,2023-05-02
1059,Five,Between son protect ability with election position weight fight kid huge.,129,58,4.173605853524336,True,19,2020-12-29,2020-12-29
1060,Machine daughter,Song gas section travel table hold between movie soldier democratic choose.,129,58,3.823984753480179,True,22,2023-09-29,2023-09-29
1061,Hotel,Fact day right nation floor former it white try though call wall.,129,58,2.6836311286324,True,29,2021-03-29,2021-03-29
1062,When,Control coach remember really exist example hotel follow answer fish court.,129,58,0.9378642603674331,True,5,2020-07-11,2020-07-11
1063,Collection consider tree anyone,Film should she three above because onto as successful various.,129,58,2.883080294896013,True,12,2023-08-25,2023-08-25
1064,Purpose service,Responsibility hospital pass run yourself least outside land.,130,3,1.0428216550670877,True,31,2023-05-23,2023-05-23
1065,Media ago woman,Bill industry check life mission draw vote sound time.,130,3,4.414834266287035,True,28,2022-06-26,2022-06-26
1066,Order generation field some,Candidate serious list American others bill turn information soon audience capital law successful beautiful.,130,3,0.2249254632332176,True,35,2021-03-11,2021-03-11
1067,Rest,Election eye ball player investment similar theory town term major everything new network.,130,4,1.1467320717010399,True,41,2021-03-09,2021-03-09
1068,Case,Successful attack drop billion economic lawyer cell three direction.,130,4,2.6121248788888414,True,44,2023-02-28,2023-02-28
1069,Single,Official raise treat spring democratic nothing hold modern remember.,130,4,1.3726960302681024,True,3,2021-05-04,2021-05-04
1070,Common son,Word suggest tell small mission popular fire.,130,4,4.994038985643004,True,10,2021-08-09,2021-08-09
1071,Simply,Certain compare possible understand economic number weight human can reality.,130,5,0.19735328505568195,True,41,2020-01-28,2020-01-28
1072,Agree,Of baby clearly include which industry moment minute pretty rather easy employee allow.,130,5,2.635046346800535,True,38,2020-01-31,2020-01-31
1073,Condition deal,Spend world gas develop mission establish account war team meet stay remain price.,130,5,4.8063627310619825,True,32,2021-01-12,2021-01-12
1074,News establish real,Reach power chair need animal partner woman two grow individual accept everyone.,130,5,0.6035528384710137,True,18,2021-06-17,2021-06-17
1075,Fall collection study end,Argue small off professor hundred forward voice almost account peace option personal.,130,5,0.9206503849298853,True,47,2023-12-13,2023-12-13
1076,Condition pull just,Hundred mention live save international up a hospital your foot add without.,130,5,3.660693412980605,True,41,2023-04-25,2023-04-25
1077,There,Per something avoid ten cultural remember life behind training.,130,5,3.90506951519608,True,11,2023-04-22,2023-04-22
1078,Remember arrive tonight,College stock glass whether though soon artist tell politics.,130,5,4.870930430004256,True,37,2023-02-04,2023-02-04
1079,Office skill,Accept avoid site skill seven force yeah technology outside act involve once.,130,5,1.6228625556007077,True,32,2020-01-24,2020-01-24
1080,Partner leg she,Nothing foreign four meeting although in.,130,6,4.673294689022915,True,5,2021-06-03,2021-06-03
1081,Clear expert,Rise example shoulder PM affect family capital support sure animal personal.,130,6,1.7268547872942985,True,27,2022-06-21,2022-06-21
1082,Fast,Reason represent staff economic really artist appear town give movement yourself maintain.,130,6,2.2108833297339543,True,23,2020-01-20,2020-01-20
1083,Technology,Notice move step same laugh gun what.,130,6,0.9504967772506939,True,48,2020-11-17,2020-11-17
1084,Officer,Very everyone beat miss find blood close.,130,6,0.06434749322751787,True,17,2022-10-20,2022-10-20
1085,Dog,Once likely use paper time possible simple road smile guy picture.,130,6,3.6658413205842684,True,6,2021-03-16,2021-03-16
1086,Its sense,Painting society hot option party from perform single.,130,7,4.8655662348335085,True,19,2022-05-24,2022-05-24
1087,High nature,Special I throughout own interview between behavior door form protect provide during.,130,7,0.7132167038943449,True,32,2020-12-22,2020-12-22
1088,Standard,Democrat voice control poor space help control.,130,7,1.595436714793797,True,41,2021-12-23,2021-12-23
1089,Born carry hope view,Health off visit site entire ready.,130,7,2.9405180404147857,True,2,2023-12-04,2023-12-04
1090,Skill audience dark language,That participant everybody clear there large through those exactly.,130,8,2.3178642387572674,True,21,2022-09-20,2022-09-20
1091,Education perhaps,Why administration wide structure want professor within approach defense character.,130,8,1.847739930015004,True,44,2020-02-12,2020-02-12
1092,Lose century old,Edge kitchen those enjoy central voice interesting drive.,130,8,3.0395283640749438,True,17,2021-02-27,2021-02-27
1093,State at,Who experience do Democrat manager make reality.,130,8,4.123605353629312,True,9,2023-09-03,2023-09-03
1094,Will,Exactly edge be model behind media evening change enough address.,130,8,2.3929202521330577,True,44,2022-05-31,2022-05-31
1095,Pretty design,Yard society right head value want rate.,130,8,4.092763332445171,True,47,2020-06-11,2020-06-11
1096,Case,Able final charge value money structure worker much.,130,8,3.2445739065051504,True,13,2020-05-24,2020-05-24
1097,Happy,Person local next drop wind response service participant cut church.,130,8,4.188039892501053,True,22,2023-12-10,2023-12-10
1098,Enjoy,Skill mission really billion station sign speak professional society degree campaign answer.,130,8,3.354440535049587,True,42,2022-01-10,2022-01-10
1099,Little term memory,Provide or just however significant value agreement computer build central.,130,9,4.677415681199579,True,37,2020-07-31,2020-07-31
1100,Give,Important and second account hot situation its sell.,130,9,3.7785705828189324,True,31,2021-07-31,2021-07-31
1101,Participant box painting,Maybe particular certainly war far Mr knowledge feeling.,130,9,1.2735000311758682,True,2,2020-04-03,2020-04-03
1102,Relationship,As strong while black make prove laugh.,130,9,4.822181519067676,True,34,2020-05-10,2020-05-10
1103,Professor happy,Race modern tax up begin believe.,130,9,3.9786539129870393,True,16,2021-09-03,2021-09-03
1104,Drug,Table fly all art might something simply old forward tend outside national.,130,9,4.77253540406938,True,44,2022-05-20,2022-05-20
1105,Family economic,Oil various commercial site during happy paper plant wear in and box worker.,130,9,4.208585693001958,True,40,2021-11-09,2021-11-09
1106,Before,Keep recently factor wish point huge dream school travel financial.,130,9,2.8120234777772133,True,30,2021-11-17,2021-11-17
1107,Condition many,Wife here field its pass difference lot.,130,9,2.9644843965415406,True,24,2023-08-12,2023-08-12
1108,Most continue himself until,Never situation late property present why whom more month crime always at list.,130,10,0.12036329482632169,True,43,2023-11-26,2023-11-26
1109,Hand,Factor nice not fight onto PM star significant education finally one policy.,130,10,2.5131666027716464,True,16,2021-08-13,2021-08-13
1110,Health,Heart great then state shoulder dinner senior remember try account.,130,10,0.6440863382246625,True,48,2020-04-06,2020-04-06
1111,Car watch real,Everybody significant wife plan her arrive analysis star contain.,130,10,4.853088894953678,True,14,2021-04-28,2021-04-28
1112,Carry,Live beyond when know authority mission practice study partner himself itself key maintain interest.,130,10,4.835791760227794,True,32,2023-03-03,2023-03-03
1113,Artist,Physical serve sign under newspaper door soon start parent vote firm.,130,10,2.237893951631935,True,29,2021-06-10,2021-06-10
1114,Treatment,Involve word from voice so article.,130,10,3.1860306795529287,True,38,2022-10-26,2022-10-26
1115,Side test allow,Safe security any piece something age security star.,130,10,4.742330271346298,True,22,2022-02-02,2022-02-02
1116,Collection adult writer newspaper,Though item yourself audience off notice tonight baby.,130,11,2.327529580403846,True,37,2022-09-30,2022-09-30
1117,Direction leg,Customer might interesting administration policy attorney few young land law inside act fight.,130,11,4.689820847271146,True,14,2022-03-07,2022-03-07
1118,Safe few,Morning price rate partner carry entire level simple.,130,11,0.6150668164020734,True,13,2020-10-07,2020-10-07
1119,Firm although major,Forward five clearly course give he think chance require.,130,11,2.381876266560065,True,28,2020-04-24,2020-04-24
