id,name,description,supplier_id,category_id,grade_average,is_active,brand_id,created_at,updated_at
376,Rich,Beyond hear everyone million myself property structure although better significant method.,127,30,3.5152946414022157,True,23,2023-11-09,2023-11-09
377,Parent,Particular listen personal rather attack picture support catch science do people have difference.,127,30,4.415266367364184,True,15,2022-02-18,2022-02-18
378,Live board,Apply six last art cultural price brother discuss local down condition soldier.,127,31,2.5784385068419233,True,39,2022-01-04,2022-01-04
379,Political,Add outside name thousand situation admit prove coach attention source firm particular challenge.,127,31,1.8882453024993462,True,18,2020-08-21,2020-08-21
380,Section east,Talk road miss available support relationship.,127,31,4.641588029540171,True,4,2022-02-16,2022-02-16
381,Address friend move,Bar call light morning trial garden security matter rule turn stay brother.,127,31,4.390955008525986,True,4,2023-01-28,2023-01-28
382,Leg,Car animal him number artist read understand account despite on.,127,31,2.4091999779437687,True,15,2021-06-17,2021-06-17
383,Art human piece detail,Newspaper follow task top concern cultural.,127,31,2.325999508684136,True,27,2022-06-15,2022-06-15
384,Animal,Pressure recognize choice idea listen buy hair.,127,31,4.217245425610415,True,29,2021-04-04,2021-04-04
385,Agent,Matter figure this make many young Republican.,127,31,0.7105211163875957,True,2,2023-11-07,2023-11-07
386,Car miss friend establish ability,Game seven quickly cut debate fight pattern glass impact night song phone.,127,31,1.9057044340221685,True,16,2023-08-22,2023-08-22
387,Task theory line beyond total,Break face very study quality five common whatever them pick know again.,127,31,3.3749683132927073,True,18,2020-01-04,2020-01-04
388,Play others,Get everything general food I also specific.,127,32,0.5192497381091216,True,44,2023-05-02,2023-05-02
389,Car,Same west own pressure walk Republican stuff successful every center.,127,32,2.80171990771736,True,26,2021-05-31,2021-05-31
390,In,Protect hear and ready later paper material.,127,32,4.046814686560375,True,47,2022-04-20,2022-04-20
391,Anything professor story between force,Matter marriage specific financial catch floor arm marriage many cover begin coach.,127,32,2.817222323937374,True,49,2022-08-29,2022-08-29
392,Open husband public down,Interview radio although several which break you support.,127,32,4.512867439291061,True,35,2021-04-22,2021-04-22
393,At again so require,Support reveal center study PM arm four cause exist marriage hear age.,127,33,2.1820170252724114,True,49,2021-02-11,2021-02-11
394,By relationship worker home,Between mother whole newspaper little side ok control.,127,33,4.942627963888431,True,27,2020-11-20,2020-11-20
395,Push,Like community son old figure process.,127,33,2.510027260616029,True,24,2022-11-12,2022-11-12
396,Finish treat sign,Type seem war include wait month purpose somebody.,127,33,2.7047153494074023,True,36,2022-09-26,2022-09-26
397,Interview,You head agency save more edge sound trouble trade rather clearly compare.,127,33,1.8968368316212847,True,41,2021-03-25,2021-03-25
398,Record,Certain ever couple attack control or standard pull tell concern order special away.,127,33,0.6173995815524314,True,14,2020-10-24,2020-10-24
399,Position catch deep responsibility,Evidence parent check certain every structure final treat ground society onto few.,127,33,4.6267582313402205,True,9,2022-08-25,2022-08-25
400,Note environmental,Hour consumer record international reduce create job likely.,127,34,4.353431980246829,True,41,2023-09-24,2023-09-24
401,Me,Who and one hotel nearly reality might girl beyond.,127,34,2.97548789558163,True,46,2023-11-19,2023-11-19
402,Government region,Physical animal human recent turn cold specific huge a team daughter.,127,35,0.8113064145092264,True,24,2021-01-02,2021-01-02
403,Defense four,Friend health find thousand threat collection.,127,35,0.21364321154089927,True,43,2021-05-05,2021-05-05
404,Determine will,Door drug glass decision well which not.,127,35,4.0766051028081645,True,16,2022-08-03,2022-08-03
405,Center in,Day until animal even wish source attention city offer resource team business.,127,35,1.5400208025183093,True,17,2023-01-27,2023-01-27
406,Argue car lawyer guess,Born number save beyond organization blue sit poor mention laugh kitchen.,127,35,1.6973509873204535,True,5,2022-05-17,2022-05-17
407,Character choose,Consumer pretty long environmental news vote.,127,35,2.0120241199046687,True,12,2021-01-23,2021-01-23
408,Body,Board trip item strong candidate street product war new produce become.,127,35,3.1311707150150134,True,31,2022-06-04,2022-06-04
409,Design debate lay science,Officer kid hour front camera six more fact source may natural east.,127,35,4.960536459459995,True,23,2023-10-29,2023-10-29
410,Anyone society human doctor green,His whether who big player candidate.,127,35,2.301896942008548,True,26,2022-08-01,2022-08-01
411,Guy,Wind enjoy increase manage position ball day final whose front available.,127,39,2.200272333487705,True,15,2022-02-19,2022-02-19
412,Despite,Late role letter job three role between water along lead everybody ground easy.,127,39,1.3462708369578498,True,23,2022-08-28,2022-08-28
413,Could include,Movement instead water product political alone task indeed hand.,127,39,2.964324356209929,True,41,2022-03-28,2022-03-28
414,Together,Safe movement right me else style tell improve ahead.,127,39,4.631863887366005,True,40,2020-11-26,2020-11-26
415,Trouble,Growth time figure four leave fast.,127,39,1.7027390615491056,True,14,2023-07-09,2023-07-09
416,Raise according,Discover sound give name billion explain left she contain.,127,40,0.07874248696869368,True,6,2022-06-24,2022-06-24
417,Her,Yard somebody sense fund hospital on ability notice establish.,127,41,2.9747050234339447,True,43,2022-01-28,2022-01-28
418,Use operation along every plan,Full present magazine prove forget almost just loss stay down.,127,41,0.05940377055157764,True,32,2021-11-04,2021-11-04
419,Hand cell,Himself pick green note perhaps shoulder specific wonder.,127,41,0.5545451596311379,True,42,2020-11-25,2020-11-25
420,Small,Win market seek term hot doctor.,127,41,4.395285013683675,True,32,2021-04-12,2021-04-12
421,Tonight teacher line up,Address coach although scientist these soldier her indicate ask cost.,127,41,1.0501643109653769,True,48,2021-02-19,2021-02-19
422,Ago teach,Her authority allow voice stock itself culture be.,127,41,1.7395008185640715,True,45,2021-02-16,2021-02-16
423,Operation various current,Prove box happy response prove happy generation fine.,127,41,2.2567681849104737,True,2,2023-07-17,2023-07-17
424,Kitchen box,Act fish difficult physical radio without day end interest assume manage.,127,41,1.9068117672872216,True,9,2023-04-29,2023-04-29
425,Purpose,Occur road Mrs number significant seven score debate.,127,41,3.7657823180979295,True,46,2022-12-20,2022-12-20
426,Wish,Mouth rate situation two by whether may people discover decade how always.,127,42,3.0982064758444867,True,33,2021-06-11,2021-06-11
427,Security field,Generation me or ever others prepare near last effect certainly more.,127,42,3.2752884479859317,True,42,2022-01-14,2022-01-14
428,Down large success less,Heart him Mrs involve four reason work plan public policy success cost.,127,42,2.496796868936004,True,12,2023-09-26,2023-09-26
429,Relate,Southern treat provide possible seek economic scene at.,127,42,3.6760547845928606,True,48,2022-06-05,2022-06-05
430,Major choose region price,Quite rest learn north ability particular would item fall right.,127,42,3.5467567067035874,True,3,2020-05-02,2020-05-02
431,Land send,Boy college turn situation science until ahead best page practice begin.,127,43,0.6089792512823272,True,49,2021-06-20,2021-06-20
432,Soldier return spend,Difficult result poor inside everybody box second measure own resource.,127,43,2.253577421023236,True,45,2023-07-04,2023-07-04
433,Relate allow,Center never success force pay theory.,127,43,2.169373133531549,True,23,2023-07-17,2023-07-17
434,Similar,Agent hundred conference else edge already attorney country simply all show account.,127,43,3.726437593737538,True,18,2020-05-24,2020-05-24
435,Eight,Want occur often peace whether herself rule pattern maybe walk worry leave interest.,127,43,0.16657191376184044,True,48,2020-07-09,2020-07-09
436,Point little decision sing,Population quality wife commercial indicate matter financial also.,127,43,2.190245820927289,True,15,2020-01-31,2020-01-31
437,Behind rock bring scene check,Easy type son follow movie take.,127,43,2.284078533983524,True,22,2021-02-11,2021-02-11
438,At,Thought weight exist fly difference spend sport kind when meeting.,127,43,3.968154947140702,True,19,2022-03-22,2022-03-22
439,Give husband,Bit suddenly hope rise up far ready building PM high.,127,43,2.477744936120558,True,35,2022-06-27,2022-06-27
440,Apply upon Mrs thus,Cover game phone every agent foot phone a drop detail authority.,127,43,3.084849508853578,True,6,2022-12-13,2022-12-13
441,History agree small,Same today building space among site young one.,127,44,3.9278622743518907,True,22,2021-12-02,2021-12-02
442,Apply specific win fast,Central sell would bring attention season up dinner whole.,127,44,0.34846600308466813,True,24,2020-12-03,2020-12-03
443,Media,Nearly better say seat son the although option office language through.,127,44,3.9366475130150027,True,11,2020-02-08,2020-02-08
444,Community,Education these international century ability for rule it goal heavy.,127,44,1.3604320711799205,True,49,2020-08-31,2020-08-31
445,That no,Road popular value these lot board.,127,44,2.0736333921731886,True,17,2021-03-12,2021-03-12
446,Yard,Situation they key matter cause open practice.,127,44,1.4746852806935458,True,4,2022-05-14,2022-05-14
447,Few party,Certain yourself have issue smile factor street continue add my.,127,44,4.010568597424701,True,35,2022-05-10,2022-05-10
448,Model hope remember herself about,Cause country Democrat law threat feeling smile.,127,44,2.5026260178255515,True,3,2020-04-06,2020-04-06
449,Number how,For husband step name until full reflect.,127,44,2.898022399674211,True,48,2023-07-15,2023-07-15
450,Shake conference,Growth especially start everyone tree provide what message market then.,127,44,3.722640922627402,True,40,2021-09-16,2021-09-16
451,Total,Business argue and safe leader wrong prepare window away degree finally.,127,45,0.4733453997105197,True,30,2021-02-21,2021-02-21
452,Allow sense,Past whole pretty smile control long current record.,127,45,2.5675694628884123,True,30,2021-03-06,2021-03-06
453,Physical measure,Certain themselves see base anyone care almost drug.,127,45,0.6880249194962834,True,28,2021-09-09,2021-09-09
454,Step,Television direction put west appear eye quite vote.,127,46,4.244134556979182,True,7,2021-07-20,2021-07-20
455,If,Goal keep interesting term former mean late view interesting increase recently world.,127,48,0.8403733574996658,True,26,2020-12-09,2020-12-09
456,Spring,Student speak design every recent cultural board race lose loss.,127,48,3.8396439879445188,True,29,2023-08-12,2023-08-12
457,Education owner near,Way movie student themselves share hundred visit such computer sense process rock.,127,48,4.179189270549307,True,41,2021-02-08,2021-02-08
458,Local somebody,Early other difference its modern product up skill trade.,127,48,1.0628391871256988,True,32,2021-01-01,2021-01-01
459,Mother seek,Training threat week expert minute need cost.,127,48,2.0126360018451543,True,15,2022-08-31,2022-08-31
460,While focus,Me strong tend oil behind career west travel.,127,48,1.9987499890239047,True,1,2022-09-28,2022-09-28
461,Yeah recently,Physical stock girl option positive show have.,127,48,2.9746696872995066,True,14,2023-08-14,2023-08-14
462,Speak after loss song specific,Deal want heart price southern report particular tonight stand training TV despite easy.,127,48,1.2180143148838045,True,28,2022-07-07,2022-07-07
463,Street,Have ask market citizen news under our around floor another deal.,127,48,3.251413124073303,True,35,2022-11-07,2022-11-07
464,Fire though data across,Law main around eat probably money expert change.,127,49,1.9856889643739266,True,7,2022-07-15,2022-07-15
465,Information table early federal behind,Ever I crime age training might help simply himself.,127,49,0.39257048407916717,True,13,2022-05-20,2022-05-20
466,Among land,Seven even him trip real professional second between you member moment rise ok.,127,49,0.11178828647320505,True,46,2023-11-07,2023-11-07
467,Major,Right yet determine feeling TV Mr of off.,127,49,1.542863309326784,True,36,2021-02-08,2021-02-08
468,Much green,Evening successful reduce seek subject artist condition.,127,49,1.153719894838479,True,11,2020-05-16,2020-05-16
469,Through home,Decision make skin citizen knowledge fish song again treat morning.,127,49,3.331215260350632,True,39,2023-03-10,2023-03-10
470,Order defense,Whole successful wrong source more baby.,127,50,3.501168249544573,True,8,2022-08-26,2022-08-26
471,Religious high,So my sit partner wish prevent throughout blood pressure management avoid road.,127,50,4.859749876334253,True,48,2020-01-16,2020-01-16
472,College,Road him current media theory generation home but practice financial.,127,51,1.3150332169547334,True,10,2020-07-15,2020-07-15
473,Attack,Economy share necessary general own new type heart education operation interview enter reason.,127,51,3.761009512094249,True,9,2020-08-03,2020-08-03
474,Movie rise never,Pattern here onto huge site its Congress today kitchen medical.,127,51,1.7221117022306676,True,12,2020-02-26,2020-02-26
475,Safe share,Field boy concern town physical contain research sport true put appear word be.,127,52,2.033544980698135,True,12,2021-07-09,2021-07-09
476,You stay true,On season message party near good.,127,52,3.5416352251100913,True,18,2020-03-26,2020-03-26
477,Attorney what hundred camera,Total rule participant foot score later law late dark whom.,127,52,1.3051989268885116,True,1,2023-12-14,2023-12-14
478,Business lot,Do serious employee might fill some.,127,52,0.36899627720445916,True,44,2022-05-13,2022-05-13
479,Idea,Risk air middle very method leg poor art raise upon think brother.,127,52,3.5920449039211193,True,16,2023-06-20,2023-06-20
480,Every,Cell serve community still think financial finally whether effort.,127,52,0.4857430647640837,True,37,2020-04-03,2020-04-03
481,Ten full,Though stage fund old course maybe least sister outside.,127,52,0.8952825020034805,True,31,2022-09-08,2022-09-08
482,Main stuff,Improve many say loss skill issue quite second four card.,127,52,0.2946473179401671,True,18,2023-03-13,2023-03-13
483,Myself,Discuss finally meet these this change over produce hotel star detail glass.,127,54,3.87198130377986,True,32,2022-09-18,2022-09-18
484,Many party military,Position market strong never many however.,127,54,3.438421214941742,True,19,2022-11-21,2022-11-21
485,Up,Stuff total become line may less.,127,54,0.8439833326147289,True,31,2023-04-16,2023-04-16
486,Table talk,Expert success actually must condition bed head not.,127,54,4.594405356855915,True,30,2023-07-23,2023-07-23
487,Use skin,Lawyer himself space yes second important follow expert explain.,127,54,4.74610253340397,True,17,2023-04-10,2023-04-10
488,High,Because stand across increase win head performance table TV ok begin.,127,54,1.8727531588039692,True,1,2022-06-16,2022-06-16
489,All mean kitchen,Sit himself leave population both within court concern.,127,54,4.173673949069795,True,15,2021-11-27,2021-11-27
490,Road learn but,Society land begin task audience finish artist during himself election threat after.,127,54,1.5278376772444668,True,34,2022-10-27,2022-10-27
491,Yard,Long meeting maybe generation weight allow my theory quality whatever professional middle upon.,127,55,2.3604122610936793,True,19,2023-11-05,2023-11-05
492,Natural five coach man,Box second threat people impact country bank religious cup TV well wall no.,127,55,0.5848311675713824,True,40,2021-11-04,2021-11-04
493,Anyone outside service,Party person thought protect beyond eye girl kitchen mind executive score consumer.,127,55,3.3060835041354,True,20,2022-05-10,2022-05-10
494,Defense,Own everyone fine south agent forget role discover feel process person remember relate.,127,55,2.188787159275612,True,14,2023-04-16,2023-04-16
495,Knowledge everybody,Involve again citizen service although part production oil another.,127,55,1.5661438993315313,True,42,2022-06-21,2022-06-21
496,Water,About laugh design live interesting only think.,127,55,0.2979248066168638,True,9,2020-06-12,2020-06-12
497,Physical,Attack treat life growth follow partner project current yet answer cause.,127,55,2.773623587406738,True,35,2021-12-08,2021-12-08
498,Particular,Need player agent risk try color data strategy trial development produce.,127,56,4.051178997457854,True,25,2020-02-02,2020-02-02
499,Hope agree,Single contain those usually everything late issue national family should property eye challenge.,127,56,3.71578089653117,True,27,2023-09-29,2023-09-29
500,Heavy least,Set store body somebody all player.,127,56,2.4370906961471093,True,33,2021-11-24,2021-11-24
501,Go source,Up blood test technology herself early television decide service cold nor nature.,127,56,2.098872101768949,True,14,2020-06-28,2020-06-28
502,Check oil since,Majority to participant growth forward full truth anything next write thousand.,127,56,3.643172935490424,True,29,2021-06-21,2021-06-21
503,Mr,Teacher be our officer operation task available.,127,56,2.1317410480795154,True,41,2023-02-11,2023-02-11
504,Authority if,Including capital evening morning main important break.,127,56,3.9402745416938108,True,25,2021-09-01,2021-09-01
505,Especially,Happy skin personal citizen ready fish place program admit ball seem past.,127,56,2.9643013527039836,True,2,2023-07-18,2023-07-18
506,Expert,One amount security role behavior city natural person large.,127,56,2.5826789736384024,True,14,2020-05-21,2020-05-21
507,Traditional,Morning former trial front consider quality cut catch.,127,56,1.2943509737425845,True,12,2021-12-28,2021-12-28
508,Firm spend matter view,None difference executive international never medical window owner edge across.,127,57,0.14731504858729982,True,25,2023-07-17,2023-07-17
509,Commercial heavy either kitchen,Generation agreement behind human local contain official political.,127,57,4.586538139480966,True,37,2023-02-27,2023-02-27
510,Station,Policy financial your leg occur ahead Mrs treat bar hit next.,127,57,2.346912773621899,True,48,2022-06-06,2022-06-06
511,Modern debate,Few specific camera organization mission young yes decision game family conference force action.,127,57,3.572087872813792,True,23,2021-04-01,2021-04-01
512,Staff brother,Forward age once article I instead success property prevent.,127,57,1.8525851404389932,True,26,2020-04-28,2020-04-28
513,Do,North represent sport deal rate save upon.,127,57,2.0272547760470983,True,42,2021-06-23,2021-06-23
514,Along,Conference industry for such ground country thing few success court seem account behind industry.,127,57,3.907506017135376,True,1,2020-10-01,2020-10-01
515,Same,At drive east assume maybe others traditional low.,127,57,0.7600797639413948,True,20,2023-12-16,2023-12-16
516,Per,Section write attention drive pick American nothing through large if feeling everyone dinner.,127,57,1.670893832455106,True,3,2022-01-12,2022-01-12
517,Note writer,Lead political picture fly easy agent middle.,127,58,3.3707912981261066,True,39,2022-03-31,2022-03-31
518,Against,Finish once our tax hotel race finish later series.,127,58,4.410035559244735,True,35,2022-01-24,2022-01-24
519,Future pressure,Prevent type garden black board summer research gas strong inside ground.,127,58,1.5382592166645663,True,2,2022-01-13,2022-01-13
520,Range Democrat outside prove,Professional worry light according expert soon identify consider guess.,128,3,3.6877835923698927,True,36,2021-11-17,2021-11-17
521,Different,Pass cultural three beautiful left economy difference inside mission number what pull.,128,3,0.7220213133658526,True,34,2022-10-04,2022-10-04
522,Record,Term week find as ten vote where process democratic significant.,128,3,1.7627065976532648,True,49,2023-11-01,2023-11-01
523,Job theory onto everybody PM,Project easy phone myself along see stock.,128,3,4.947255783769504,True,30,2023-05-17,2023-05-17
524,Area,Purpose remain evening do be voice natural item store various social indicate type.,128,4,4.245296214389178,True,31,2023-01-25,2023-01-25
525,Move spend anything yet,Respond middle expect particular everybody order statement population different bag bring nature.,128,4,0.7132321225890764,True,47,2021-01-04,2021-01-04
526,Benefit green,Nor consider positive cultural character purpose number imagine themselves argue enjoy court.,128,4,0.17050258878227753,True,47,2023-05-02,2023-05-02
527,Road,Big everything serious allow camera far rate.,128,4,1.080317278820545,True,15,2020-03-24,2020-03-24
528,Citizen,Open head something management PM oil peace.,128,4,0.9118434448020291,True,4,2021-03-31,2021-03-31
529,Able,Would maybe realize none anyone send worker be skill address argue.,128,4,4.15442889409383,True,10,2023-09-19,2023-09-19
530,Next,Exactly ability well stock minute life radio oil send window market.,128,4,0.12937815348989856,True,7,2020-02-06,2020-02-06
531,Blood new,Last father customer remember media interview.,128,4,0.8376950420002377,True,44,2021-03-18,2021-03-18
532,Our produce Congress alone,Career campaign offer within if customer.,128,5,2.904606359860682,True,21,2022-06-24,2022-06-24
533,Last provide,During individual these early help quite table option fear example.,128,5,1.0622637529846946,True,38,2023-06-27,2023-06-27
534,Theory person series,Thousand kind born just interesting mean.,128,6,2.561327743781128,True,25,2022-04-17,2022-04-17
535,Give amount,Collection clearly exist drug board nearly sign finish and determine scientist when what edge.,128,6,3.0229247048194545,True,17,2020-07-19,2020-07-19
536,Sing summer trip own challenge,Power where street soon health student drive car question truth change we the.,128,6,0.6789506480472046,True,1,2020-10-07,2020-10-07
537,Sit discover top wrong,Hot leader however knowledge without road middle once south that.,128,6,3.455797749026472,True,33,2022-07-23,2022-07-23
538,Even agent,Security only market mind idea election.,128,6,3.192731162047673,True,3,2023-04-22,2023-04-22
539,Air know even owner,Name either age look stand charge despite.,128,7,3.6811425034251855,True,10,2022-08-05,2022-08-05
540,Instead,Specific matter buy already blue three.,128,7,4.896004814100462,True,26,2021-12-06,2021-12-06
541,Fly letter design,Wife paper daughter true once loss structure game late just sound wrong tough.,128,7,1.3483150037825442,True,36,2023-04-12,2023-04-12
542,Year begin sing enough summer,Administration determine lot drug reality wife claim.,128,7,2.575163313216868,True,21,2022-01-03,2022-01-03
543,Smile rest,Field few whatever doctor wrong thank red.,128,7,0.924440960480532,True,34,2020-09-04,2020-09-04
544,Range western long,Whatever east majority road sell watch party key visit before dog on.,128,7,1.3744307026294216,True,7,2022-01-19,2022-01-19
545,Attorney newspaper find,Do positive sea foreign despite owner lay field scientist such.,128,7,1.4208420327671978,True,2,2021-04-17,2021-04-17
546,Indicate thousand next,Last day democratic imagine sound easy father husband alone population hand east entire.,128,7,4.081563659985951,True,41,2021-05-30,2021-05-30
547,Relate,Scientist election kind bag country beautiful.,128,7,1.9062687815582657,True,49,2022-05-23,2022-05-23
548,Product four,Stop base probably physical of environment.,128,7,2.3665508966374187,True,11,2023-12-12,2023-12-12
549,Mrs see job hard remember,Firm born effort say college and.,128,8,1.835217107003952,True,41,2021-09-26,2021-09-26
550,Industry some teacher admit how,Not top within represent get example down nor while positive standard off.,128,8,2.02841111530029,True,28,2023-03-20,2023-03-20
551,Movie so,Tough must goal head inside anything.,128,8,3.8650944266983855,True,45,2023-03-28,2023-03-28
552,Daughter,Learn surface large response throughout pressure relate watch least task cup policy.,128,8,2.365858281765918,True,44,2021-03-20,2021-03-20
553,Step candidate whose,Let tonight often remain specific type human college mouth generation to article father fight.,128,8,3.794792322900591,True,21,2020-02-19,2020-02-19
554,Along wrong article,Meeting floor sound key see during seem serious resource.,128,8,2.0615576795114343,True,3,2023-11-30,2023-11-30
555,Scientist,Teach later work treatment significant market where land boy place.,128,8,4.931847313282487,True,45,2021-04-19,2021-04-19
556,Seem outside enjoy religious,Break few operation character direction pretty that investment per my.,128,9,2.698193089595489,True,1,2021-04-30,2021-04-30
557,Most require,Three citizen American practice wide sure pull key smile life weight.,128,9,0.24028225355122224,True,26,2020-05-24,2020-05-24
558,Second,Their end off participant police system call fear as real seven baby the.,128,9,4.446103154126798,True,2,2022-05-07,2022-05-07
559,Paper make,Anything major eight paper age treat information letter trip but.,128,9,1.775516543195605,True,16,2023-09-04,2023-09-04
560,Bit either evidence,Itself cover recently whatever while wonder plan memory assume white behind.,128,9,0.9381721078073929,True,44,2021-09-14,2021-09-14
561,Development,Someone source miss baby prove often one.,128,10,2.3398238512174085,True,17,2023-10-31,2023-10-31
562,Door,Win increase claim evening opportunity staff statement near economy.,128,10,2.852074395420267,True,38,2020-04-16,2020-04-16
